"id","user_id","message","status","createdAt","updatedAt"
"1","1","Officiis cupiditate cum in quis a consequuntur. Dolor nihil magni nisi rerum labore consectetur. Tempora eos et quis consectetur fugiat. Et quam nulla molestias nobis beatae et.","pending","2020-06-20 09:03:49",NULL
"2","2","Ut illo quia ut omnis officiis quaerat asperiores. Dolorem dicta et quo quis earum. Autem eaque neque totam exercitationem ut quisquam. Explicabo sed nihil a unde sint.","completed","2020-06-20 09:03:49",NULL
"3","2","In optio impedit ab porro molestiae id ea. Perferendis reprehenderit aspernatur omnis et recusandae iure et. Doloribus asperiores voluptatibus autem harum. Earum explicabo ut perferendis voluptatem quae. Sit aperiam magni qui est et eius.","pending","2020-06-20 09:03:49",NULL
"4","3","Minima dolorem eveniet molestias tempore. Repudiandae nulla cumque ex quia aperiam harum fuga. Fugiat qui quam perspiciatis. Unde cumque alias quos voluptatem.","inprogress","2020-06-20 09:03:50",NULL
"5","3","Provident consequatur aut aut vitae. Eaque saepe tempore omnis voluptate distinctio. Qui repellat minus voluptatum ut quam accusantium porro dolores. Expedita omnis eaque rem iusto ipsa non.","completed","2020-06-20 09:03:50",NULL
"6","3","Quia sit voluptatem est aperiam ea dolore. Quas possimus excepturi quod doloremque pariatur ut ea et.","inprogress","2020-06-20 09:03:50",NULL
"7","4","Et porro ipsam dolores porro optio impedit est consectetur. Et eos eos et harum vero. Et eum minima consequatur vel culpa exercitationem.","inprogress","2020-06-20 09:03:51",NULL
"8","5","Provident cum minima et mollitia ab officia quibusdam. Ullam vel consequatur et et consequuntur cumque ut. Quasi expedita atque rerum cum rerum sunt. Modi quaerat expedita omnis libero voluptatem excepturi.","inprogress","2020-06-20 09:03:51",NULL
"9","5","Soluta beatae repellendus necessitatibus sequi. Nam sint eaque in voluptatum id quaerat non veniam. Dolorum quis quaerat saepe autem aut sed ex.","completed","2020-06-20 09:03:51",NULL
"10","6","Officiis eos odio est cum consequatur qui odio. Ipsum consequatur qui optio. Qui numquam illo molestias blanditiis id.","completed","2020-06-20 09:03:51",NULL
"11","6","Eos repellat eaque qui sit eum. Delectus cumque provident itaque officia omnis. Natus praesentium assumenda eligendi quisquam eum.","pending","2020-06-20 09:03:51",NULL
"12","7","Id rerum ea veniam rerum unde quam. Aliquid deleniti perferendis id. Cum eligendi non sit qui amet debitis dignissimos odit.","completed","2020-06-20 09:03:51",NULL
"13","8","Quasi qui ipsam placeat qui. A assumenda ipsam libero mollitia et exercitationem consequatur. Numquam nulla sit minus distinctio est nemo.","inprogress","2020-06-20 09:03:52",NULL
"14","9","Ipsum repudiandae quos molestias minima nobis eveniet. Ipsam dicta beatae enim eos sint omnis et. Cupiditate et ducimus at debitis optio quisquam. Laudantium vel sed itaque qui veritatis id illo.","inprogress","2020-06-20 09:03:52",NULL
"15","10","Quasi incidunt rerum alias fugiat est possimus. Aspernatur et ullam voluptates et aspernatur minus est. Ut veniam velit distinctio voluptates autem consequatur sint.","inprogress","2020-06-20 09:03:52",NULL
"16","10","Autem assumenda eaque ut animi aut doloremque officia. Ut consequatur dolorem sit aliquid quia. Est velit natus nobis perspiciatis maiores voluptas quidem.","completed","2020-06-20 09:03:52",NULL
"17","10","Incidunt necessitatibus veritatis non consequuntur quasi eum reiciendis aut. Nostrum odit repellendus magnam dolorum est aliquam rerum quasi. Ut dicta sint sint aliquid dolorem.","inprogress","2020-06-20 09:03:52",NULL
"18","11","Odit itaque molestiae qui mollitia ipsam velit omnis. Exercitationem minus assumenda similique non. Velit aut illo non ab id fugiat laudantium. Praesentium et recusandae quo rerum.","inprogress","2020-06-20 09:03:53",NULL
"19","12","Deleniti iusto quia vero voluptatem non explicabo. Aut eligendi excepturi ut eum fugiat. Voluptatem eum commodi et recusandae quasi aut perspiciatis natus. Ea dolore laudantium et atque autem.","completed","2020-06-20 09:03:53",NULL
"20","12","Cupiditate cum voluptatem dolor velit. Iusto nihil iure quo dolores alias. Possimus qui tenetur reprehenderit repellat.","inprogress","2020-06-20 09:03:53",NULL
"21","13","Facilis autem qui odio eos alias dolor. Ipsam quasi porro nisi itaque non. Perspiciatis ratione consequuntur voluptatum alias aliquam.","inprogress","2020-06-20 09:03:53",NULL
"22","13","Omnis reprehenderit aliquid impedit laudantium qui. Tempore similique sed et dolores in. Modi et id molestiae nisi esse aut.","completed","2020-06-20 09:03:53",NULL
"23","13","Molestiae culpa praesentium aspernatur natus rerum eligendi. Voluptatem minima veritatis dolor. Ipsum tenetur nihil amet ea et error reprehenderit. Aut facere officia illo fuga molestiae corrupti. Sit aut accusantium nostrum sunt autem nam cum.","inprogress","2020-06-20 09:03:53",NULL
"24","14","Atque voluptatum soluta molestiae facilis harum. Eveniet expedita reprehenderit ad rerum libero veritatis. Voluptates dicta dolore enim non odit accusantium.","inprogress","2020-06-20 09:03:53",NULL
"25","14","Sint pariatur dolores possimus beatae autem quod. Est ipsa tenetur et non nihil non aut. A ut et et cumque et vero.","pending","2020-06-20 09:03:53",NULL
"26","15","Ratione repellendus possimus itaque eaque ea cumque veritatis. Ut nam et perspiciatis qui tempora blanditiis.","inprogress","2020-06-20 09:03:54",NULL
"27","15","Labore ut inventore et aspernatur iure. Distinctio itaque ab sunt odit ex. Iste voluptatibus iusto eum et corporis. Deleniti sit aperiam omnis cum dolor ex saepe rerum. Asperiores dignissimos consequatur ut quo.","pending","2020-06-20 09:03:54",NULL
"28","16","Qui et sint ipsa fugit qui fugit aut. Excepturi occaecati voluptas asperiores voluptas sit quisquam. Consequatur tenetur laboriosam mollitia impedit nulla eius qui qui. Odio quae et in ad ducimus sed ipsa.","pending","2020-06-20 09:03:54",NULL
"29","17","Praesentium qui illum neque eos est quidem asperiores vel. Deserunt eum architecto cum corporis qui omnis dolores.","pending","2020-06-20 09:03:54",NULL
"30","17","Voluptas quisquam autem enim neque. Totam et nesciunt voluptatem velit. Molestiae et laboriosam ad exercitationem amet.","inprogress","2020-06-20 09:03:54",NULL
"31","18","Sed eaque iste voluptatibus natus molestiae. Et iusto architecto totam quibusdam. Fugit nobis eligendi et cumque dolorem id enim.","pending","2020-06-20 09:03:55",NULL
"32","18","Fugiat officia qui recusandae fugiat at. Porro ullam numquam voluptatem quia adipisci. Velit rerum adipisci quia nostrum asperiores dicta.","pending","2020-06-20 09:03:55",NULL
"33","18","Debitis ipsum atque unde cupiditate nobis saepe. Sapiente excepturi reiciendis ut quae quo velit dolorem veniam. Quo temporibus exercitationem exercitationem.","inprogress","2020-06-20 09:03:55",NULL
"34","19","Cupiditate fugit excepturi quia et consequatur. Voluptatem consequuntur quo asperiores omnis voluptatibus repudiandae. Perspiciatis nesciunt autem sint est officiis est similique. Autem maxime molestiae veniam perspiciatis ut ab qui.","completed","2020-06-20 09:03:55",NULL
"35","19","Nobis facere voluptate enim hic nemo in tenetur. Voluptatem necessitatibus libero vero autem qui. Ut assumenda ab tempora sed dolores.","completed","2020-06-20 09:03:55",NULL
"36","20","Nemo tempore aut quam rem sit magnam nostrum. Harum et vel et deserunt et odit. Repellendus repellendus rerum voluptas quos necessitatibus.","inprogress","2020-06-20 09:03:55",NULL
"37","21","Non qui maxime illo non officiis. Itaque ipsa quis laborum quisquam natus et perferendis. Est ut voluptatum voluptatibus et in. Quo dicta voluptatem cumque inventore voluptatibus nam.","inprogress","2020-06-20 09:03:55",NULL
"38","21","Qui animi et consequuntur iure natus. Qui ut nihil est distinctio deserunt. Culpa quisquam voluptatum fugit in voluptatem odio occaecati. Quidem molestias aperiam quia commodi. Itaque sit omnis minima temporibus est et debitis facilis.","completed","2020-06-20 09:03:55",NULL
"39","21","Labore distinctio adipisci sint et. Amet harum voluptatem ut. Velit maxime corrupti beatae aut repudiandae. Excepturi consectetur eius qui ipsa aut.","completed","2020-06-20 09:03:55",NULL
"40","22","Ut officiis qui magnam voluptatem sit error ab et. Accusantium omnis doloribus aut quam rerum fugit quasi accusamus. Quas in aspernatur aspernatur ex ut quisquam. Reprehenderit temporibus ad deserunt aut aspernatur dolor ut.","completed","2020-06-20 09:03:56",NULL
"41","23","Maiores consequuntur odio accusantium suscipit praesentium velit. Ipsam sed sed impedit ut et rem adipisci aut. Ex saepe repudiandae quis doloribus ut soluta quia. Aut ab distinctio reiciendis ut corporis sunt.","inprogress","2020-06-20 09:03:56",NULL
"42","23","Qui dolorem neque eaque facilis deleniti aut itaque. Aspernatur dolorem eum dolore quidem eos eaque.","completed","2020-06-20 09:03:56",NULL
"43","23","Ipsa quo tenetur ipsam qui maiores sed cumque. Labore ut sed quae nulla omnis ut. Cum qui laborum quis earum officia. Qui magnam rerum natus asperiores est consequatur asperiores. Rem ullam vel maiores voluptas occaecati ab nihil.","inprogress","2020-06-20 09:03:56",NULL
"44","24","Ut tenetur quia omnis labore tempore. Quo facere et consequatur pariatur. Doloremque quo et nesciunt maiores harum odit ut.","completed","2020-06-20 09:03:56",NULL
"45","24","Qui quisquam et rerum nisi aut quia a id. Distinctio enim sit est impedit ut a veniam. Fugit unde distinctio reprehenderit consequatur autem incidunt suscipit ut. Sed necessitatibus iste provident qui libero consequatur expedita.","completed","2020-06-20 09:03:56",NULL
"46","24","At cupiditate vel aut omnis. Rerum saepe alias tempora nihil et et. Placeat dolor tempore repellendus qui consequuntur iure. Inventore aperiam omnis harum accusantium.","pending","2020-06-20 09:03:56",NULL
"47","25","Dicta deleniti beatae consequatur fuga. Deserunt qui aut repellendus quia sint. Aut iure culpa ipsum placeat. Atque necessitatibus cupiditate maxime sequi.","pending","2020-06-20 09:03:57",NULL
"48","25","Eaque sit voluptatum magnam non labore cum et eveniet. Autem tenetur et culpa dolorem ut et. Et cumque ipsum blanditiis eaque harum omnis quae. Delectus porro placeat deleniti saepe aut nostrum.","completed","2020-06-20 09:03:57",NULL
"49","26","Aliquid cupiditate ducimus eveniet odio. Maiores voluptatem vel voluptas cumque hic non. Quibusdam inventore corporis dolorem qui. Hic quam sit mollitia soluta totam et cumque.","completed","2020-06-20 09:03:57",NULL
"50","27","Voluptate quaerat placeat et atque est totam. Tenetur ullam et nihil magnam. Quam quo quia accusantium autem mollitia. Eum a sapiente aspernatur voluptas dolorum quasi rerum.","inprogress","2020-06-20 09:03:57",NULL
"51","27","Et sit sit id eum et sunt et. Architecto odio modi aut non fugit non. Eos et atque voluptatum voluptatem enim culpa. Doloribus occaecati molestias ab nihil quaerat earum facilis.","inprogress","2020-06-20 09:03:57",NULL
"52","27","Quaerat dolores ad quo voluptas mollitia et. Eveniet odio nulla sunt facere aut molestiae. Architecto quam quibusdam aut voluptate assumenda est aut. Earum est omnis enim quia. Non odio provident vitae quod velit quaerat.","pending","2020-06-20 09:03:57",NULL
"53","28","Autem voluptatem inventore enim beatae. Aut cumque deserunt et voluptatem. Recusandae voluptates nulla voluptatem amet numquam. Labore nulla aut autem qui dolores saepe.","inprogress","2020-06-20 09:03:58",NULL
"54","28","Voluptas dolorem dolorem in alias cumque est a. Nihil recusandae mollitia asperiores sed id sunt. Autem et nemo optio fugiat molestias aut deserunt. Est rerum est sunt earum perspiciatis iusto.","inprogress","2020-06-20 09:03:58",NULL
"55","28","Debitis molestiae quo aliquam nulla. Atque nihil doloremque ut amet et. Sed amet quas odio accusantium et nesciunt accusantium.","pending","2020-06-20 09:03:58",NULL
"56","29","Saepe qui deserunt ex. Aut quod qui ducimus eum aut. Error reprehenderit ea eius eaque nostrum porro quo. Voluptatem aliquid laudantium earum id laborum odit.","inprogress","2020-06-20 09:03:58",NULL
"57","30","In iste vel exercitationem officiis. Eos veniam rerum fuga delectus ut. Omnis et exercitationem debitis magnam enim quo voluptas.","pending","2020-06-20 09:03:58",NULL
"58","30","Qui exercitationem magni expedita consectetur. Asperiores deserunt autem dolorum aperiam quis iure. Voluptatum quia voluptatum ipsa beatae odit voluptate est.","inprogress","2020-06-20 09:03:58",NULL
"59","31","Neque doloribus ullam aut exercitationem voluptatem. Unde optio totam quia nesciunt qui cum distinctio ducimus.","pending","2020-06-20 09:03:59",NULL
"60","31","Dolor eius molestiae veniam qui voluptas autem. Ea qui perspiciatis possimus omnis sit quo. Aut fugit pariatur consequatur officiis ratione temporibus aut. Exercitationem in a autem excepturi ipsa.","pending","2020-06-20 09:03:59",NULL
"61","31","Illo fugit at ea unde blanditiis. Et sint molestiae ut porro repellat pariatur maxime. Deleniti et qui aspernatur ut nostrum. Ipsa voluptatem maiores ducimus maxime ea culpa esse. Cupiditate et nostrum sequi aspernatur aut cumque.","completed","2020-06-20 09:03:59",NULL
"62","32","Quas sit rerum impedit repellat. A explicabo libero quam porro quo officiis. Necessitatibus porro sed animi sit architecto sed. Consequatur id perspiciatis voluptas amet consequatur at necessitatibus.","pending","2020-06-20 09:03:59",NULL
"63","33","Rerum accusamus cupiditate et deserunt et dolores quos. Nulla odio omnis quae alias et sunt porro sint. Qui aut molestiae accusantium dicta. Et autem ut ex quo ut.","inprogress","2020-06-20 09:03:59",NULL
"64","33","Enim voluptatem qui qui reiciendis mollitia eius et. Porro ducimus sunt ipsum modi non dolor. Et qui velit soluta. Nisi sed officiis quae adipisci corrupti itaque.","completed","2020-06-20 09:03:59",NULL
"65","33","Quasi itaque et impedit qui voluptatem et nesciunt. Omnis mollitia eius doloremque quod voluptatem. Reprehenderit quo maiores natus consequatur et. Illo enim hic repellendus earum debitis.","inprogress","2020-06-20 09:03:59",NULL
"66","34","Deserunt dolor quasi accusamus sint quia libero a. Maxime voluptas culpa autem quo eaque eius quo nihil. Asperiores nemo autem voluptatibus sequi qui quasi.","pending","2020-06-20 09:03:59",NULL
"67","35","Libero mollitia nihil non voluptas. Quia nemo omnis reprehenderit laborum aut. Dolore voluptatibus nostrum dolorum libero corporis.","pending","2020-06-20 09:04:00",NULL
"68","35","Incidunt ea placeat eveniet quia. Et omnis enim incidunt ea qui rerum ullam.","pending","2020-06-20 09:04:00",NULL
"69","35","Inventore et eligendi nisi. Id consequatur minus nemo quia. Veniam voluptas aliquid minus at aut illo.","completed","2020-06-20 09:04:00",NULL
"70","36","Qui officia fuga possimus nihil. Quisquam quod expedita est. Minus molestiae iure accusantium accusantium expedita sint dolore.","completed","2020-06-20 09:04:00",NULL
"71","36","Possimus dignissimos aut inventore magni nemo quidem laboriosam. Eum nam fuga veritatis magni sint inventore consectetur. Beatae itaque occaecati autem. Id maiores aut debitis rerum ab.","pending","2020-06-20 09:04:00",NULL
"72","36","Ipsam sint id esse consequatur consequatur cumque eos. Soluta commodi et placeat dolorem dolore quis sapiente dolorem. Sunt tempore est est libero et ut iure. Fugiat minima deserunt culpa reprehenderit velit consequatur. Adipisci consequatur enim labore dolorem.","completed","2020-06-20 09:04:00",NULL
"73","37","Voluptatem minus eos dolorem. Eius tenetur quibusdam aut. Dolorum animi est magnam dolor porro. Sit nihil est ullam sit modi.","pending","2020-06-20 09:04:01",NULL
"74","37","Aut iure distinctio dolorem enim. Consequatur qui aut et modi omnis. Voluptas enim fugit repellat illo temporibus.","pending","2020-06-20 09:04:01",NULL
"75","37","Neque quam deserunt consequuntur ut. Animi odit nobis dicta accusantium quis omnis. Rem nam consequuntur autem non voluptate quis quia.","completed","2020-06-20 09:04:01",NULL
"76","38","Ab qui et tempore sunt quam optio. Voluptatum unde sit distinctio dolorem aliquam vero nihil. Et laudantium autem cumque eum ex. Et qui facilis totam et quae et.","pending","2020-06-20 09:04:01",NULL
"77","39","Eveniet iusto laboriosam quasi iusto est dicta. Harum aut unde veniam odit enim provident. Ipsa ipsa debitis et.","inprogress","2020-06-20 09:04:01",NULL
"78","39","Quia eos ipsum voluptas et. Qui ut molestiae nobis sit. Sint magni asperiores quasi eos dolorem nam suscipit. Illum dolore consequatur voluptate voluptas labore.","completed","2020-06-20 09:04:01",NULL
"79","39","Accusantium eum harum omnis. Voluptas ut consequatur omnis voluptatem debitis. Facilis debitis illo iste eum numquam et velit ratione. Nobis et inventore error voluptatem in.","completed","2020-06-20 09:04:01",NULL
"80","40","Qui et accusamus veritatis quod earum. Autem ut officia quo dolorem iure voluptatem et. Repellendus repellendus veniam nihil rerum. Soluta et dolorem facilis vitae.","completed","2020-06-20 09:04:01",NULL
"81","40","Similique provident explicabo accusamus voluptas unde quis. Optio dolorum quasi in harum sit pariatur. Repellendus aliquam sed molestiae est ut voluptatem nihil.","pending","2020-06-20 09:04:01",NULL
"82","40","Est accusantium unde laboriosam saepe ad perspiciatis. Quo occaecati est dolorum nesciunt qui autem. Velit vel cumque sapiente doloribus non tenetur.","completed","2020-06-20 09:04:01",NULL
"83","41","Voluptate mollitia distinctio reiciendis rerum. Similique suscipit fuga odit. Sit consequuntur commodi vel. Eum aut voluptatem quibusdam fugit deleniti.","completed","2020-06-20 09:04:02",NULL
"84","41","Consectetur ex quis ullam consectetur est a ullam quibusdam. Eos dolores enim voluptatem occaecati corporis corrupti ut.","pending","2020-06-20 09:04:02",NULL
"85","42","Fuga voluptatem qui velit quis accusantium eos aut. Similique officiis ea facilis magnam. Vitae ut quia sunt veniam iusto ut. Dolores ad illum est tenetur facere et.","completed","2020-06-20 09:04:02",NULL
"86","43","Iure aut doloremque quidem magni dolor et assumenda. Molestiae autem sit pariatur explicabo sint impedit placeat veritatis. Ut suscipit iusto qui deleniti est.","completed","2020-06-20 09:04:02",NULL
"87","43","Sint molestiae sed nihil architecto illo sed. Unde praesentium quod ea dolore. Et omnis ad ad vero. Praesentium inventore ipsa quia aliquam.","inprogress","2020-06-20 09:04:02",NULL
"88","44","Eveniet necessitatibus ratione et cumque facere. Commodi reiciendis qui ut. Unde ducimus ut est facilis perferendis.","inprogress","2020-06-20 09:04:02",NULL
"89","44","Nihil qui dolor velit et culpa ut. Blanditiis non enim ut molestias necessitatibus minima. Quibusdam aut accusantium in corrupti eos distinctio ut.","inprogress","2020-06-20 09:04:02",NULL
"90","45","Mollitia omnis quidem recusandae at. Sed consectetur dolor autem similique eum eligendi. Eum cum vel consectetur consectetur facilis.","completed","2020-06-20 09:04:03",NULL
"91","46","Ipsam necessitatibus nemo iusto quas. Dolorem et recusandae quaerat vel nesciunt quisquam ut facere. Soluta cum perspiciatis id nam. Voluptatem deserunt quis eum expedita ad.","completed","2020-06-20 09:04:03",NULL
"92","47","Illum blanditiis deleniti officiis. Qui velit eaque tenetur autem velit occaecati mollitia aut. Optio excepturi qui deserunt qui.","inprogress","2020-06-20 09:04:03",NULL
"93","48","Doloribus accusantium et similique cumque nemo. Deserunt aspernatur sunt ipsam voluptate labore non molestiae consequatur. Ratione illum quisquam est fugiat explicabo. Rerum eos dolor ex et.","inprogress","2020-06-20 09:04:03",NULL
"94","49","Dolorem quas est omnis omnis. Ut impedit nihil doloremque et adipisci at quia. Dolor molestiae ut sint id ad est sequi.","pending","2020-06-20 09:04:03",NULL
"95","49","Quaerat placeat quas blanditiis voluptatum sequi. Beatae maxime quo quasi sit. Et sit rerum quaerat voluptatem eius numquam.","inprogress","2020-06-20 09:04:03",NULL
"96","50","Asperiores natus recusandae adipisci et similique quia. Facere voluptatem voluptatem a qui. Tempora est porro nisi aut voluptas ut dolores.","pending","2020-06-20 09:04:04",NULL
"97","50","Beatae id nihil est nisi exercitationem voluptas porro amet. Veritatis ullam et molestiae quia amet. Doloribus perferendis expedita perferendis possimus.","completed","2020-06-20 09:04:04",NULL
"98","51","Et qui omnis id officiis. Sit laudantium ipsum eligendi ea eum et aliquid molestiae. Voluptatum corporis quo ducimus in. Impedit et vero libero nemo.","pending","2020-06-20 09:04:04",NULL
"99","51","Qui sit excepturi qui id. Et officiis ut voluptas corrupti aliquam. Nostrum debitis velit nostrum facilis neque facilis voluptas iste. Et ea voluptatem repellat vel expedita quia autem.","completed","2020-06-20 09:04:04",NULL
"100","52","Iure earum facilis dolores omnis ipsam enim velit est. Quod quos doloribus ut qui.","completed","2020-06-20 09:04:04",NULL
"101","52","Eos quae dignissimos numquam consequuntur. Ratione laborum perspiciatis veritatis commodi nisi omnis optio. Suscipit vero officia libero ducimus perferendis. Error doloribus nobis eum iusto laborum architecto.","pending","2020-06-20 09:04:04",NULL
"102","53","Repellat quidem doloremque rerum laboriosam et dolore repudiandae. Rem ut incidunt molestias. Est rerum ut veritatis animi nihil in reprehenderit. Enim nihil est eius.","completed","2020-06-20 09:04:04",NULL
"103","53","Perferendis ea quia placeat voluptatem ducimus ipsam. Soluta labore eaque delectus non nisi est sint qui. Aliquid omnis saepe est et assumenda sit aut cupiditate.","completed","2020-06-20 09:04:04",NULL
"104","54","Occaecati aut inventore est enim ullam dolor est. Nesciunt quo voluptas non accusamus nulla quia. Eum molestiae sunt et quasi iure rem.","completed","2020-06-20 09:04:05",NULL
"105","54","Perspiciatis vel sit harum ut natus velit quo. Debitis quia officiis modi dignissimos. Et aut amet laboriosam adipisci consectetur. Provident quo similique natus repudiandae architecto tenetur.","pending","2020-06-20 09:04:05",NULL
"106","54","Fugit ducimus enim assumenda voluptatem officiis reiciendis. Molestias et ut possimus et doloremque. Omnis ullam sint cupiditate est odio. Delectus temporibus explicabo minus sunt aut sint dignissimos.","completed","2020-06-20 09:04:05",NULL
"107","55","Iusto necessitatibus asperiores animi sed voluptas. Ipsam voluptatem et esse occaecati aut ipsam delectus officiis. Aut rerum et eum eum voluptatibus tenetur vel.","pending","2020-06-20 09:04:05",NULL
"108","56","Minus sunt non et ratione delectus sit a. Voluptas aut qui odit quia dolores quidem consequuntur. Quia ea totam hic ea qui. Ipsam alias unde explicabo provident minima facilis autem.","completed","2020-06-20 09:04:06",NULL
"109","56","Velit nihil consequuntur id ea. Hic eos consequatur saepe. Nesciunt eveniet numquam eius fuga. Dolorum eius consequatur dolorem optio dolorem rerum. Enim sapiente quidem optio odit.","pending","2020-06-20 09:04:06",NULL
"110","57","Occaecati sed totam provident quia. Ut id dolor veniam dolorem quaerat qui. Corporis ipsam temporibus aut laborum praesentium nesciunt.","inprogress","2020-06-20 09:04:06",NULL
"111","58","Maiores fugiat ad odio qui repellendus est veniam debitis. Qui illum et aut voluptatem vel. Occaecati consectetur facere corporis et. Aspernatur et rerum adipisci delectus sed iusto a ut. Nihil ut iure dicta provident.","completed","2020-06-20 09:04:06",NULL
"112","58","Est doloremque deleniti nesciunt soluta nesciunt quo. Ut dolorem minus quas autem quaerat fugiat explicabo. Voluptas occaecati exercitationem vitae eum inventore voluptatibus molestias. Voluptas voluptatem ipsum molestiae accusamus voluptatem numquam saepe.","completed","2020-06-20 09:04:06",NULL
"113","58","Recusandae dolor eum officiis quod dicta cupiditate. Et voluptas consequatur voluptas ea at dicta. Velit sit odio ducimus animi velit perferendis sint doloribus.","completed","2020-06-20 09:04:06",NULL
"114","59","Maxime sit in ab qui perferendis impedit est. Aut cupiditate nam necessitatibus enim. Et sint atque molestiae eum eius deleniti dolorum ut. Eos cupiditate veritatis minima necessitatibus aut ipsum nemo.","pending","2020-06-20 09:04:07",NULL
"115","59","Illum tenetur magnam odio ea. Non nihil ut ipsam rerum.","completed","2020-06-20 09:04:07",NULL
"116","59","Magni quidem et non odit atque dignissimos magnam. Doloribus est aut assumenda omnis quia natus voluptate debitis. Aliquam consequatur id a aut eum repellat.","pending","2020-06-20 09:04:07",NULL
"117","60","Est atque ut quae nulla amet est ipsum. Ratione quod fugit consectetur autem provident ipsa libero autem. Quos animi placeat voluptates dolor et perspiciatis.","pending","2020-06-20 09:04:07",NULL
"118","61","Voluptas accusamus excepturi omnis ut sit. Quia dignissimos aut vero sed. Ducimus aut dolores in aut ea.","inprogress","2020-06-20 09:04:07",NULL
"119","61","Amet id quia tenetur tenetur et. Ratione et alias dignissimos quisquam ab omnis animi. Autem optio voluptates debitis quae magnam id aliquid.","inprogress","2020-06-20 09:04:07",NULL
"120","61","Aliquid in eius veritatis et possimus tenetur. Vel quia debitis itaque eligendi provident voluptatem tenetur.","pending","2020-06-20 09:04:07",NULL
"121","62","Ut fugiat sapiente atque deserunt at. Voluptatem rerum cupiditate libero illo dolores ad minus. Deserunt neque amet magnam magnam.","pending","2020-06-20 09:04:08",NULL
"122","62","Quam ducimus rem illum accusamus voluptatibus eum qui. Voluptas eligendi molestiae et occaecati. Porro in sint porro tempora accusantium.","pending","2020-06-20 09:04:08",NULL
"123","63","Et cumque ut et dicta et. In aut enim modi harum. Dignissimos quis sunt sed nihil.","completed","2020-06-20 09:04:08",NULL
