"id","user_id","message","status","createdAt","updatedAt"
"488","243","In quos ea rem atque error temporibus fugit. Eos sed quam dolor illo molestias et aut ut. Adipisci odit facilis excepturi cumque non voluptatem. Similique et eos facere omnis distinctio autem cupiditate tenetur. Consequuntur inventore cum aspernatur adipisci aut ea eaque ab.","completed","2020-06-20 09:04:59",NULL
"489","244","Sit quis esse officiis sint optio adipisci. Sint consectetur perspiciatis omnis consequatur illum pariatur. Eius voluptatem minus ipsa dignissimos incidunt illum. Sequi officiis aliquid totam enim.","inprogress","2020-06-20 09:04:59",NULL
"490","245","Aperiam adipisci iste neque sint dicta autem. Qui corrupti aut aut quod et. Similique natus unde corporis et.","completed","2020-06-20 09:04:59",NULL
"491","245","Mollitia quae deleniti non omnis. Magni asperiores voluptatem ullam. Rerum voluptas autem alias. Ipsa exercitationem maxime blanditiis expedita laudantium atque consequuntur. Consectetur voluptatum eum optio qui.","completed","2020-06-20 09:04:59",NULL
"492","245","Suscipit natus voluptates sapiente in iure animi. Eum quaerat et veritatis ipsam vero ex. Temporibus sint optio non eveniet.","pending","2020-06-20 09:04:59",NULL
"493","246","Ipsam aperiam pariatur amet sunt. Commodi ut iure et voluptas nihil aut sequi. Quia maiores magnam hic deleniti ut quae molestiae. Vel et inventore autem beatae.","completed","2020-06-20 09:04:59",NULL
"494","246","Temporibus nobis at incidunt quidem dicta. Et voluptatum occaecati quia molestias. Asperiores quis dolores ducimus non.","inprogress","2020-06-20 09:04:59",NULL
"495","247","Rerum perspiciatis eos aliquam et veritatis pariatur. Totam rerum rerum qui necessitatibus neque maiores voluptatibus. Expedita voluptatem magnam iusto dolores aspernatur. Provident repellat totam eius dolore ipsam.","completed","2020-06-20 09:05:00",NULL
"496","248","Aut id fugit consequatur velit minus sapiente aspernatur. Expedita pariatur odio qui. Eum nihil debitis minima impedit perspiciatis. Nostrum aut et minima sint odio ut nobis dignissimos.","completed","2020-06-20 09:05:00",NULL
"497","249","Dolore labore repellendus autem in odit architecto eveniet. Aut harum quam neque commodi. Quis dolor magni beatae tempora.","pending","2020-06-20 09:05:00",NULL
"498","249","Et deserunt quia quibusdam totam. Perspiciatis rerum voluptas ullam alias tempora. Est sed aut eligendi eum. Cumque modi doloremque quia dolor qui.","pending","2020-06-20 09:05:00",NULL
"499","250","Et qui harum est eius facilis. Earum distinctio beatae soluta tenetur.","completed","2020-06-20 09:05:01",NULL
"500","250","Dolorem et illo ut minima architecto dolores. Fugit quod incidunt sint omnis excepturi. Velit in enim beatae quibusdam rem est. Adipisci aut officia odit quam.","pending","2020-06-20 09:05:01",NULL
"501","250","Voluptate rerum nostrum reiciendis nisi provident et ut. Reprehenderit recusandae nisi qui sed saepe rerum. Impedit fugiat eum aut hic rerum saepe impedit.","completed","2020-06-20 09:05:01",NULL
"502","251","Et molestiae animi ad ea laudantium quidem aperiam. Voluptatem ratione maiores nulla aut ut. Recusandae voluptatem voluptates delectus inventore voluptatem. Voluptates id aliquid autem quis rerum ullam. Ipsum architecto tempore odit est.","pending","2020-06-20 09:05:01",NULL
"503","251","Quia earum voluptates tenetur praesentium doloribus. Deleniti accusamus quia id totam aut perferendis voluptatem.","completed","2020-06-20 09:05:01",NULL
"504","252","Id delectus dicta ex eum repellendus fugit. Maxime ut ad et sapiente qui dolores occaecati. Voluptates ipsa optio commodi et.","inprogress","2020-06-20 09:05:01",NULL
"505","252","Optio dolorum fuga quas porro dolores temporibus. Nihil occaecati dolor deserunt vel. Est vel est est qui sunt et. Quis excepturi consectetur nobis. Architecto dolores facilis fugit et.","pending","2020-06-20 09:05:01",NULL
"506","253","Corrupti corporis ratione accusantium exercitationem dolores expedita rerum. Eaque ea et sunt aut consequatur molestiae. Ut optio ut molestiae reprehenderit sed sint.","completed","2020-06-20 09:05:01",NULL
"507","253","Quae velit ea inventore eum. Officiis soluta sit magni qui sit. Exercitationem earum numquam aperiam quia vitae doloremque commodi.","inprogress","2020-06-20 09:05:01",NULL
"508","253","Quisquam necessitatibus ab temporibus qui omnis. Ut mollitia odio earum neque minus deserunt earum sit. Aut quis quod dicta et et at quibusdam.","inprogress","2020-06-20 09:05:01",NULL
"509","254","Qui vitae molestiae similique aut ducimus. A pariatur accusamus perferendis doloremque ea. Omnis cupiditate id esse quo id quos architecto. Quo perspiciatis consequatur voluptatem dolore ipsam magnam fugit.","completed","2020-06-20 09:05:02",NULL
"510","254","Inventore dignissimos quia natus quam officia aut expedita. Eveniet excepturi consectetur voluptates repellendus autem aliquid. Et quam eos recusandae ut qui aliquid.","inprogress","2020-06-20 09:05:02",NULL
"511","254","Voluptatem aut accusantium quas et illum et. Recusandae odio aliquid laudantium perspiciatis. Sit id saepe possimus magni ipsam ut repudiandae. Consequuntur dolorem consequuntur quo officia.","completed","2020-06-20 09:05:02",NULL
"512","255","Odio eos tempora occaecati iusto voluptatem consequatur aut. Aut ut et minima alias quia exercitationem architecto. Qui vero ea animi ea eaque. Minima et ullam et aliquam quas.","inprogress","2020-06-20 09:05:02",NULL
"513","256","Aut vero et magnam et odio. Amet et possimus voluptas in accusantium natus.","completed","2020-06-20 09:05:03",NULL
"514","256","Aut nam magnam assumenda suscipit sunt explicabo sapiente pariatur. Sed unde reiciendis beatae omnis. Beatae ut aut at veritatis perspiciatis. Deserunt eaque explicabo et harum est dolore.","pending","2020-06-20 09:05:03",NULL
"515","257","Suscipit architecto nam quia perspiciatis in eum. Rerum eos beatae id adipisci ducimus quod ut. Accusantium optio inventore non qui.","completed","2020-06-20 09:05:03",NULL
"516","258","Eligendi id et aut dolores. Molestiae est odit consequatur ex unde ipsa. Iste nesciunt neque velit. Libero tenetur saepe cupiditate repellendus.","pending","2020-06-20 09:05:03",NULL
"517","258","Quis beatae qui blanditiis nobis. Numquam mollitia qui et corporis ea et vitae architecto. Velit officia quidem nihil pariatur.","completed","2020-06-20 09:05:03",NULL
"518","259","Optio quam velit voluptas sed laborum. At rerum ullam libero culpa. In culpa placeat commodi error. Ipsa laboriosam omnis tempora illum nihil dignissimos rerum.","inprogress","2020-06-20 09:05:03",NULL
"519","259","Voluptatum est consequatur animi ipsum expedita necessitatibus. Molestias nostrum iusto quia alias expedita blanditiis in dolorum.","pending","2020-06-20 09:05:03",NULL
"520","259","Sapiente explicabo sed laborum. Numquam ipsam sed voluptas voluptas laboriosam.","completed","2020-06-20 09:05:03",NULL
"521","260","Consequuntur porro et quos provident. Unde saepe accusantium ipsum aperiam sit.","pending","2020-06-20 09:05:04",NULL
"522","260","Consequuntur ex autem porro quaerat. Voluptas velit omnis iste sequi iste. Similique possimus magnam ipsa perspiciatis sint sed exercitationem.","pending","2020-06-20 09:05:04",NULL
"523","260","Quia non pariatur magnam eum. Et nulla ut in omnis id rerum.","inprogress","2020-06-20 09:05:04",NULL
"524","261","Quam impedit odio ab. Quos alias minima ut pariatur tenetur molestias ut rem. Quos molestias ea autem omnis corrupti aut.","pending","2020-06-20 09:05:04",NULL
"525","261","Eius quibusdam natus est distinctio. Sit itaque et sunt id neque ut. In aut totam laudantium ut vel quaerat occaecati veniam. Tempore quos delectus quibusdam animi qui ea quasi.","pending","2020-06-20 09:05:04",NULL
"526","261","Quas praesentium blanditiis est non. Nemo nostrum id minus. Incidunt sint commodi voluptates nihil voluptas. In voluptas omnis autem repellendus.","inprogress","2020-06-20 09:05:04",NULL
"527","262","Dolores voluptate qui nemo minima repellendus alias. Doloribus rerum voluptatem dolores eligendi. Incidunt aperiam dolorum maxime fugit sunt error quo. Voluptatum enim reiciendis cumque fugit blanditiis.","pending","2020-06-20 09:05:04",NULL
"528","262","Autem earum placeat atque sed. Necessitatibus quae iste iure animi nam ipsam. Quis consequatur hic iusto quaerat quis dolorum doloribus.","inprogress","2020-06-20 09:05:04",NULL
"529","262","Ut placeat illo accusantium occaecati suscipit ipsum. Rem enim voluptatibus minima nam facere nulla non asperiores. Nam facere alias dolores eligendi. Suscipit est vitae quasi.","completed","2020-06-20 09:05:04",NULL
"530","263","Deleniti vel vero natus blanditiis autem. Fuga repellat dolor similique velit aut. Odit quo quis quaerat deserunt molestiae.","pending","2020-06-20 09:05:05",NULL
"531","264","Rerum quae distinctio ut maxime cupiditate perspiciatis. Exercitationem ut harum asperiores rerum. Et illum fugit ad quo accusamus. Ut odit ut labore culpa nobis quis eos.","completed","2020-06-20 09:05:05",NULL
"532","264","Et deserunt repellendus et repellendus voluptatum. Accusantium vel voluptatem placeat et molestiae ducimus consequuntur. Ut assumenda et quidem incidunt in aut et.","pending","2020-06-20 09:05:05",NULL
"533","265","Et voluptate ea dolorum. Dolor cupiditate perspiciatis est aspernatur culpa ut inventore. Eos et sed doloribus ducimus impedit.","pending","2020-06-20 09:05:05",NULL
"534","266","Numquam earum et ad ut qui. Voluptatem rerum explicabo tenetur rerum enim doloremque commodi minima.","completed","2020-06-20 09:05:06",NULL
"535","266","Nulla corrupti aut sed numquam assumenda unde. Dolore repellendus ut sunt consequatur omnis nesciunt rerum. Inventore non numquam voluptate commodi sit quam. Expedita enim ut dignissimos enim doloremque nobis nostrum.","inprogress","2020-06-20 09:05:06",NULL
"536","266","Explicabo esse voluptates impedit mollitia eaque. Dolorem qui sapiente non sequi voluptatem itaque. Sit non qui sint ut adipisci fuga non. Illo aliquid quisquam eius velit voluptates velit eos. Omnis adipisci soluta beatae.","pending","2020-06-20 09:05:06",NULL
"537","267","Asperiores fugit aut dolorum eos qui quod. Consectetur sunt eveniet enim id. Atque laudantium facere exercitationem error dolorem omnis. Eius aut velit consequatur dolorum est alias reprehenderit nobis.","completed","2020-06-20 09:05:06",NULL
"538","267","Expedita dolores temporibus veritatis quia. Atque deleniti non maxime consequatur necessitatibus. Nostrum sit harum earum id ex neque reprehenderit. Repellat ipsum et eos dolor pariatur illum quis veritatis.","inprogress","2020-06-20 09:05:06",NULL
"539","267","Asperiores enim aut error et laudantium ex qui. Rem in et culpa reiciendis cumque nihil autem. Ex non atque molestias fugit quaerat repudiandae. Molestias est libero sapiente.","inprogress","2020-06-20 09:05:06",NULL
"540","268","Autem est corrupti nemo sed vel ut. Unde nihil ut harum velit dolores laudantium. Saepe ab et et sit dolorem animi totam.","completed","2020-06-20 09:05:07",NULL
"541","269","Illo in fugiat maiores tempore exercitationem fuga adipisci. Aut est et molestiae minima maiores. Omnis voluptates doloribus sed sit fuga nihil et vitae. Dolores tempora corporis qui facilis.","pending","2020-06-20 09:05:07",NULL
"542","270","Voluptatem tenetur ut autem aliquid at dicta amet. Officiis quos esse ab corrupti aut iure. Aut ut magni commodi voluptatibus voluptatem eum. Ad qui voluptas facilis. Deserunt nobis non ut perspiciatis ut et.","completed","2020-06-20 09:05:07",NULL
"543","270","Et eaque rerum voluptatem nam culpa ab blanditiis. Blanditiis sed adipisci consequatur maiores. Itaque nulla aut sequi aliquid. Inventore quos reiciendis modi sed aliquid officia laboriosam.","completed","2020-06-20 09:05:07",NULL
"544","271","Iusto soluta doloribus consectetur quis commodi. Est alias occaecati eius et officia et. Rerum sit molestiae voluptatem officiis dicta earum. Iure nisi voluptatem nesciunt ducimus alias.","pending","2020-06-20 09:05:07",NULL
"545","271","Est aliquam doloremque voluptas voluptas voluptate laudantium eum. Quisquam voluptatem provident minus nostrum aliquam ratione placeat. Est a quae error labore est et et.","completed","2020-06-20 09:05:07",NULL
"546","271","In et dolore cupiditate aut iusto molestiae. Sunt eveniet doloribus aspernatur facere. Hic voluptas voluptas voluptatem quia veritatis rerum voluptatem. Magni perspiciatis beatae deserunt natus laudantium adipisci reprehenderit.","inprogress","2020-06-20 09:05:07",NULL
"547","272","Numquam autem sit quidem voluptatum adipisci voluptatem. Eum atque dolorum quos consequatur omnis.","inprogress","2020-06-20 09:05:08",NULL
"548","273","Perspiciatis eos omnis veniam voluptate rerum enim reprehenderit. Dolores qui quaerat officia aspernatur aut soluta enim. Quia voluptatem accusamus corrupti. Impedit nihil maiores repellat sit accusamus libero.","pending","2020-06-20 09:05:08",NULL
"549","274","Non dolores quas omnis dicta. Nam quos sapiente aut aperiam explicabo perferendis nulla. Perferendis earum magnam officiis magni aspernatur. Ab et dolor autem est ipsum.","completed","2020-06-20 09:05:08",NULL
"550","274","Consectetur sapiente beatae quo earum aut. Non vel mollitia et. Quidem vero non voluptas nesciunt aut repudiandae et itaque.","pending","2020-06-20 09:05:08",NULL
"551","274","Eos quod quia quia voluptas. Quae quia esse voluptatibus debitis. Adipisci dolor ut veniam vero. Facere laboriosam numquam molestias tenetur a at.","pending","2020-06-20 09:05:08",NULL
"552","275","Commodi ipsum asperiores voluptatum eos earum natus voluptas voluptatem. Aliquam totam rerum dolores illo fugiat qui et. Maiores quibusdam alias molestiae rerum et voluptatem.","inprogress","2020-06-20 09:05:09",NULL
"553","275","Non deleniti qui minus quasi rerum corporis. Ratione eum iste aut expedita. Itaque fuga voluptates nihil harum recusandae debitis.","pending","2020-06-20 09:05:09",NULL
"554","276","Aut temporibus nesciunt distinctio et itaque est voluptatum dolor. Illum a optio et nihil harum. Enim beatae vel sit rerum ipsam provident. Architecto debitis sint laborum voluptas quia sed facilis soluta.","pending","2020-06-20 09:05:09",NULL
"555","277","Nobis ratione aut id veniam quis et aliquid itaque. Et odit voluptatem sapiente ut dicta consequatur explicabo at. Ea voluptas modi libero.","pending","2020-06-20 09:05:09",NULL
"556","277","Magni ipsam ab dolores accusantium necessitatibus necessitatibus. Sit suscipit quia sunt repellat. Autem eos facere ratione eum et. Asperiores minus et eveniet minus.","pending","2020-06-20 09:05:09",NULL
"557","278","Eveniet esse quibusdam quia ut ea. Omnis consequuntur consequatur non et explicabo qui. Voluptate placeat officiis perferendis est sunt natus numquam.","completed","2020-06-20 09:05:10",NULL
"558","279","Assumenda recusandae labore esse facere et vitae quia. Possimus perspiciatis enim iste et. Laudantium ut sunt sint ducimus sit rerum. Accusantium non soluta aut perferendis labore itaque quasi.","pending","2020-06-20 09:05:10",NULL
"559","280","Maxime architecto velit ut sint unde est corrupti quis. Esse rerum ut est placeat optio voluptatem odio fuga. Commodi non quia molestias ducimus corrupti.","pending","2020-06-20 09:05:10",NULL
"560","281","Voluptatem labore ad quod omnis consectetur. Ex quo nostrum nisi aut qui doloribus. Voluptatem odio asperiores asperiores explicabo eligendi aut aliquid.","pending","2020-06-20 09:05:10",NULL
"561","281","Reiciendis illum eaque delectus dicta nulla totam. Voluptatibus quaerat voluptatem ducimus atque iusto accusamus. At est blanditiis omnis voluptatem repellat.","pending","2020-06-20 09:05:10",NULL
"562","281","Dolor expedita ea quas excepturi expedita et nihil ut. Suscipit occaecati architecto laudantium autem laborum ducimus est. Asperiores repellat beatae aut animi fugit. Eos alias ea repudiandae cum ab repudiandae odio.","pending","2020-06-20 09:05:10",NULL
"563","282","Quidem vero quo optio dignissimos asperiores aut. Nihil rerum ea non ad sunt. Et tempora autem impedit inventore. Error fugiat cupiditate omnis magnam amet est.","inprogress","2020-06-20 09:05:11",NULL
"564","283","Nisi error sit hic ut quasi quas distinctio. Reiciendis et ipsum ad dolores voluptatum et ullam natus. A ea fuga corrupti corrupti ut id. Quae distinctio quisquam minus atque eos ipsam.","inprogress","2020-06-20 09:05:11",NULL
"565","283","Ab est delectus quod ut est enim excepturi culpa. Voluptatem tempore at ipsam dolorem harum. Occaecati sit libero laudantium inventore. Impedit explicabo consequatur at laudantium explicabo.","pending","2020-06-20 09:05:11",NULL
"566","284","Omnis dicta officia sint nemo. Libero ipsam expedita sint odio aut modi dignissimos earum. Debitis id et amet quasi. Et dicta minima dolores.","pending","2020-06-20 09:05:11",NULL
"567","284","Delectus ex laborum perspiciatis accusantium. Repellendus et ea ipsa cum alias vitae. Fuga doloribus deleniti explicabo in.","completed","2020-06-20 09:05:11",NULL
"568","284","Omnis odit ipsa voluptate perspiciatis. Sunt voluptatum fugit accusamus eos corrupti commodi minima. Minus ut voluptatum commodi sit non dolores. Quia eos inventore aut.","inprogress","2020-06-20 09:05:11",NULL
"569","285","Cum omnis a magnam. Aut dolores cupiditate id dolores velit distinctio hic repellendus. Perferendis tenetur odit ducimus voluptatibus. Est sint et dolores officiis quia aut molestias quam.","inprogress","2020-06-20 09:05:12",NULL
"570","285","Omnis vitae ut impedit amet similique ut iusto. Autem maiores ipsam dolorem nemo. Consequatur cumque fuga non quod.","completed","2020-06-20 09:05:12",NULL
"571","285","Odit et odio amet rem beatae nam. Et qui nam et veritatis animi. Corporis nemo totam aut ipsum.","completed","2020-06-20 09:05:12",NULL
"572","286","Velit quis est et expedita vero dolores. Et quas et repellat qui tempora hic. Accusamus facere vel praesentium deleniti.","completed","2020-06-20 09:05:12",NULL
"573","286","Quo repellat nihil facere porro unde suscipit ut delectus. Tenetur eveniet repudiandae optio unde et. Quis consequuntur illum sapiente deserunt exercitationem debitis. Nulla molestias accusantium corrupti voluptatibus totam quae.","inprogress","2020-06-20 09:05:12",NULL
"574","286","Est dignissimos molestiae perferendis ipsa aliquam eos. Eaque voluptate voluptatem sed. Sed et rerum excepturi at.","pending","2020-06-20 09:05:12",NULL
"575","287","Dolorem ex rerum molestiae suscipit ad animi est. Vitae aliquid autem veritatis ut fuga itaque. Suscipit perspiciatis sunt quidem et modi.","pending","2020-06-20 09:05:12",NULL
"576","287","Praesentium illum ad eaque unde. Nihil beatae nobis beatae omnis. Vitae sed voluptatum odit quaerat. Animi excepturi expedita impedit quia doloribus quis autem.","pending","2020-06-20 09:05:12",NULL
"577","287","Et non eum tempora numquam impedit. Odio ducimus odit unde eligendi accusantium odit.","completed","2020-06-20 09:05:12",NULL
"578","288","Consequatur quia rem qui. Blanditiis rerum a enim facere reiciendis quia maxime. Possimus nesciunt doloribus velit minus iste voluptas.","pending","2020-06-20 09:05:13",NULL
"579","288","Quam est repellendus et nihil. Dolor ipsam minima laudantium dolorum optio temporibus. Molestiae inventore expedita labore quibusdam. Minus labore odit rerum.","completed","2020-06-20 09:05:13",NULL
"580","289","Dolores fuga asperiores quia et nemo sapiente et. Voluptatem enim nihil harum reiciendis numquam esse. Dignissimos qui ad eius inventore. Corrupti corrupti voluptatem et.","completed","2020-06-20 09:05:13",NULL
"581","289","Repellendus delectus iste laborum beatae ut reiciendis. Rem consequatur occaecati similique neque est. Ea aut ut maxime minus. Labore nihil expedita nobis voluptas.","completed","2020-06-20 09:05:13",NULL
"582","290","Ex id ut occaecati consequatur. Assumenda rerum culpa porro quidem atque fuga ullam.","completed","2020-06-20 09:05:13",NULL
"583","290","Dolore consequatur voluptatum similique voluptatem doloribus autem fuga. Est quia deserunt veritatis et qui eaque aut. Aliquam ea aut voluptate exercitationem dignissimos unde. Consequatur sit pariatur veritatis et alias ut libero.","inprogress","2020-06-20 09:05:13",NULL
"584","291","Consectetur aut explicabo earum et dicta. Molestiae qui ut rerum dolores. Nostrum sit facilis consequatur consectetur facere.","inprogress","2020-06-20 09:05:13",NULL
"585","292","Illum dolor sunt facere et et voluptate. Porro sunt consequatur molestiae dolores dolores soluta. Fugiat debitis vel quam optio eum velit quae pariatur. Aut voluptatem saepe qui commodi in esse facilis ut.","pending","2020-06-20 09:05:14",NULL
"586","292","Fuga sit sed et sint reprehenderit sint corporis. Unde aut beatae quia illum. Ex voluptatem ea nostrum accusantium.","inprogress","2020-06-20 09:05:14",NULL
"587","293","Quas excepturi est illum rem qui quos optio. Aspernatur magnam nam eius ut itaque fugit quis. Totam eum voluptas et qui eveniet. Consequatur aspernatur qui nulla quo.","inprogress","2020-06-20 09:05:14",NULL
"588","293","Repudiandae quis amet quibusdam sunt porro amet ut. Nulla voluptas perferendis fugiat aliquam ut exercitationem. Itaque occaecati dolorem nisi et. Esse magni voluptatem quod ullam voluptatem quia tempora. Natus numquam dolorem totam sed eum tenetur voluptatum.","inprogress","2020-06-20 09:05:14",NULL
"589","294","Mollitia et eum ad aut possimus consequuntur accusamus. Aut voluptatem commodi qui ratione saepe voluptatem iste. Illum aut ab nobis itaque odit animi. Ad quidem aut libero quo dolorum magnam earum quaerat.","completed","2020-06-20 09:05:15",NULL
"590","294","Sint commodi qui quo natus numquam aut temporibus. In et numquam at qui aut. Possimus enim facilis sint id molestias suscipit. Illum mollitia maxime eaque saepe.","completed","2020-06-20 09:05:15",NULL
"591","294","Veniam fuga adipisci omnis ut doloribus dolore asperiores. Omnis vel voluptatibus porro dolor officia velit. Voluptas qui eos omnis perferendis sequi. Deserunt veniam officia repellat qui qui aliquam inventore eaque.","inprogress","2020-06-20 09:05:15",NULL
"592","295","Quod odio voluptatibus molestiae ducimus numquam magni debitis. Quibusdam voluptatem inventore consequatur vero voluptas corrupti. Libero eum recusandae sed eaque. Voluptatum reprehenderit mollitia voluptate consequatur mollitia perspiciatis aliquid. Nihil omnis aut quod ut voluptas.","completed","2020-06-20 09:05:15",NULL
"593","295","Est sit quaerat est ut quia ducimus ad. Iure quia quae quas suscipit consequuntur rem. Quisquam at sit aut et est expedita. Hic omnis aut ratione non expedita aliquam et beatae.","completed","2020-06-20 09:05:15",NULL
"594","296","Tempora non occaecati numquam veritatis et est. Rerum delectus rerum vero consequatur est ea qui. Facilis atque enim in laudantium provident enim.","completed","2020-06-20 09:05:15",NULL
"595","296","Et molestiae iusto illo officiis autem dolor. Blanditiis dolore incidunt voluptatum corporis. Hic ut qui eos sint commodi necessitatibus repudiandae.","completed","2020-06-20 09:05:15",NULL
"596","297","Sit praesentium libero tempore ea. Non sint qui omnis cum maiores cumque accusantium. Voluptatem ut maxime laudantium qui quas consequatur non.","inprogress","2020-06-20 09:05:15",NULL
"597","297","Et ab libero suscipit itaque repellendus. Ut molestiae numquam rem. Voluptates ut ut aut.","pending","2020-06-20 09:05:15",NULL
"598","297","Ea quis aliquid delectus aspernatur sed. Aut eius labore eos. Autem et veritatis maiores recusandae sit adipisci. Illum rerum modi facilis nesciunt perferendis suscipit.","completed","2020-06-20 09:05:15",NULL
"599","298","Vero velit enim aut quia consequatur cumque dolor. Ea delectus optio ut sit aperiam consequatur.","inprogress","2020-06-20 09:05:16",NULL
"600","298","Ut quia consequatur est saepe veritatis non. Et enim est quasi molestiae quam voluptatem.","pending","2020-06-20 09:05:16",NULL
"601","298","Laudantium mollitia deserunt recusandae dolor aperiam tenetur ut enim. Culpa qui dicta aliquid rerum. Repellat quibusdam est quis reprehenderit velit aut ut. Adipisci deserunt consequatur ut totam et mollitia enim.","completed","2020-06-20 09:05:16",NULL
"602","299","Quis ducimus error velit dolores et veniam sapiente. Qui architecto sed a molestiae minus ut. Sequi ratione provident praesentium qui. Quia facere aut molestias a.","pending","2020-06-20 09:05:16",NULL
"603","299","At eos impedit autem et nesciunt quo asperiores. Exercitationem ut culpa eveniet et magnam omnis. Perspiciatis ipsa consectetur repudiandae natus autem sit. Non est ea quo ut ut.","pending","2020-06-20 09:05:16",NULL
"604","299","Deleniti ut modi impedit quas quia veritatis harum. Aut necessitatibus qui aut consequatur eos.","pending","2020-06-20 09:05:16",NULL
"605","300","Est ratione officiis aut aliquam. Ea sed sed officia nulla. Molestiae rerum consequatur doloribus aut. Odit aliquid et veniam ut ut quis expedita.","pending","2020-06-20 09:05:16",NULL
"606","300","Quam ut unde dolore aliquam est sed explicabo. Non omnis voluptatibus quo dolor earum. Aut non illum veritatis aliquam eligendi vero voluptatem veniam. Unde fugit repudiandae consequatur magnam ad quia.","completed","2020-06-20 09:05:16",NULL
"607","301","Eum reiciendis voluptas illum et et. Et tempora est et doloremque non ea. Eum quas sed est nemo nam laborum. Mollitia repellat ut eius quidem consequatur libero.","pending","2020-06-20 09:05:16",NULL
"608","301","Culpa perferendis placeat ut optio ex nostrum vel sit. Mollitia itaque tenetur error minus tempore et.","pending","2020-06-20 09:05:17",NULL
"609","302","Expedita facilis et velit quibusdam. Sed sed blanditiis quibusdam est sit est. Ut ut est aperiam inventore excepturi. Distinctio exercitationem aperiam qui rerum rem dolorum.","inprogress","2020-06-20 09:05:17",NULL
