"id","user_id","message","status","createdAt","updatedAt"
"1462","733","Praesentium autem ab eos et nulla consequuntur aut. Fugit et est labore. Excepturi perferendis vero molestiae. Eos fuga incidunt dolorem natus enim. Aspernatur qui tenetur voluptas est.","inprogress","2020-06-20 09:07:24",NULL
"1463","733","Eum recusandae hic nihil. Voluptatem rerum quae quia aut non. Qui dolore voluptatem accusantium magnam.","inprogress","2020-06-20 09:07:24",NULL
"1464","733","Magni accusantium cupiditate inventore est nihil quam id. Dolorem unde omnis est error. Tenetur quo autem iusto dolor placeat adipisci. Quia sed ducimus voluptatem veniam.","pending","2020-06-20 09:07:25",NULL
"1465","734","Sunt autem et qui delectus iure non. Fugit iure a enim nulla quam. Molestias aspernatur consequuntur et deleniti delectus ipsum rerum. Praesentium reiciendis autem ut maiores deleniti ea et.","completed","2020-06-20 09:07:25",NULL
"1466","735","Vel assumenda deleniti aut fuga molestiae qui officia. Iste voluptatem pariatur laboriosam corporis ea. Sit eos qui necessitatibus consequatur pariatur. Quia voluptas nihil provident dolores adipisci minus qui.","completed","2020-06-20 09:07:25",NULL
"1467","735","Officiis itaque dolorum debitis sed cumque fuga ut sit. Asperiores iste cupiditate aut dolor aut odit. Ab possimus molestias velit accusantium in qui quo occaecati. Temporibus nulla quaerat et veniam.","pending","2020-06-20 09:07:25",NULL
"1468","735","Et adipisci quisquam porro iusto dolores perferendis. Non veniam sint occaecati. Ipsa nulla numquam ut aut voluptates iusto consequuntur.","pending","2020-06-20 09:07:25",NULL
"1469","736","Aut cum quod dolor reiciendis quis. Quidem sequi iure rerum maxime autem. Natus distinctio qui officiis eum ut ut. Officiis aut dolor qui.","pending","2020-06-20 09:07:25",NULL
"1470","736","Ut nesciunt voluptates eum tempore. Molestias modi est vitae aliquam at laborum voluptas sit. Quis eius ipsum commodi vel sunt amet.","completed","2020-06-20 09:07:25",NULL
"1471","736","Voluptas quos fugiat et facere placeat possimus quae. Iste dolorum quis eveniet nostrum amet quas dolor. Quis corporis voluptas eos commodi ducimus similique quia. Dolores quis quisquam minima.","inprogress","2020-06-20 09:07:25",NULL
"1472","737","Sit est earum nobis provident fugiat sed. Ut quo ea ut sint accusamus. Occaecati quas vel quibusdam voluptatem voluptas. Maxime similique omnis velit ut incidunt nisi.","inprogress","2020-06-20 09:07:26",NULL
"1473","738","Sit nisi inventore non et. Repellendus facilis ratione recusandae quam nostrum dicta error. Ullam dolor libero veritatis.","pending","2020-06-20 09:07:26",NULL
"1474","739","Alias ratione est eos esse. Nulla esse vitae occaecati temporibus impedit. Temporibus minus nihil hic nesciunt omnis non.","completed","2020-06-20 09:07:26",NULL
"1475","740","Quos sed doloribus consectetur possimus qui. Et aliquam consequatur omnis dolor. Ut quo sequi reiciendis est illum ex quisquam. Quos aut laudantium enim repellendus magni ab fugit. Saepe perspiciatis dignissimos laudantium impedit explicabo dolorem possimus.","pending","2020-06-20 09:07:26",NULL
"1476","740","Veritatis et alias possimus et accusamus in. Sed soluta reprehenderit ipsa voluptatem voluptatum. Et rerum laboriosam et rerum. Cumque ut eveniet omnis eum fugiat ipsa adipisci.","completed","2020-06-20 09:07:26",NULL
"1477","741","Ut enim tempore vel itaque maxime officia. Consequatur sunt fugiat quia facilis ad assumenda. Itaque alias labore velit alias et asperiores accusamus.","completed","2020-06-20 09:07:26",NULL
"1478","741","Libero dolor maiores ipsum enim qui. Ut consectetur nihil aut consequatur earum perferendis. Esse dicta ea sed voluptas consequuntur aut sed. Sit necessitatibus dolore aperiam eos itaque.","inprogress","2020-06-20 09:07:26",NULL
"1479","742","Cumque pariatur praesentium consequatur voluptatem cum. Maxime neque dolores laudantium iusto inventore architecto. Labore autem modi ab. Vel ullam iusto sit fugit.","completed","2020-06-20 09:07:27",NULL
"1480","742","Rem ut a at rerum optio doloribus cum. Aut quis occaecati nemo ut maxime iusto. Ipsum et laboriosam sunt.","completed","2020-06-20 09:07:27",NULL
"1481","743","Earum ut pariatur voluptatum quis. Error porro aut doloremque aut nulla aliquid sunt beatae. Culpa sunt nesciunt voluptatum.","inprogress","2020-06-20 09:07:27",NULL
"1482","743","Ex voluptatem ut quis harum eos sed. Alias aspernatur dignissimos labore alias. Ea quia possimus fugit in perspiciatis eos maiores. Rerum hic hic et qui.","completed","2020-06-20 09:07:27",NULL
"1483","743","Illo est quisquam vitae molestiae. Et quia quae aliquid rem quos quod excepturi. Consequatur voluptatem consectetur numquam aut doloribus quis corporis ab.","inprogress","2020-06-20 09:07:27",NULL
"1484","744","Qui omnis est quia. Nam inventore nihil totam et in ipsum voluptatem.","pending","2020-06-20 09:07:27",NULL
"1485","744","Tempora deserunt libero ut dolor magnam vel. Excepturi ducimus sed neque exercitationem esse ipsum. Et similique maxime sed enim fuga voluptatem.","pending","2020-06-20 09:07:27",NULL
"1486","745","Deserunt enim laborum ex expedita magni quas error. Nihil autem ducimus officiis recusandae. Aut nulla minima explicabo delectus. At eum qui ullam laboriosam.","completed","2020-06-20 09:07:28",NULL
"1487","746","Voluptatibus nisi ut aperiam omnis dolorem. Qui corrupti quos nesciunt consequatur temporibus architecto animi. Eius quas fugit fugit suscipit. Quae voluptatem ut praesentium molestiae quaerat.","inprogress","2020-06-20 09:07:28",NULL
"1488","746","Qui quis deserunt nemo exercitationem. Ut dolorem beatae temporibus consequuntur. Sunt voluptatum rem sunt vitae dolorem.","inprogress","2020-06-20 09:07:28",NULL
"1489","746","Quasi similique laborum corrupti sit ullam ut natus. Consequuntur sint itaque adipisci eius aut. Eaque quia quia corporis eum laudantium dolorum est nisi. Eos et illo commodi provident saepe earum molestiae reiciendis.","pending","2020-06-20 09:07:28",NULL
"1490","747","Odit dolorem possimus earum possimus. Repellendus omnis sequi aut recusandae mollitia voluptas. Maiores qui esse qui error et doloribus maiores.","pending","2020-06-20 09:07:28",NULL
"1491","747","Sed vel ducimus optio libero repudiandae iste. Reiciendis qui repellendus maiores molestiae debitis ut qui. Necessitatibus id fugit eligendi enim.","completed","2020-06-20 09:07:28",NULL
"1492","748","Numquam incidunt esse aut nemo vel et. Dignissimos fuga esse laboriosam est facere veritatis. Ut neque aperiam delectus sit.","pending","2020-06-20 09:07:28",NULL
"1493","749","Temporibus aut sunt ut expedita. Beatae cupiditate eius consequatur quo perspiciatis minima molestiae. Ipsam eum quo soluta deleniti ut exercitationem molestias.","pending","2020-06-20 09:07:29",NULL
"1494","750","Ipsa neque modi modi quis magni et. Quaerat minima consequatur qui recusandae. Ut nam ipsam dicta consequatur natus sit.","inprogress","2020-06-20 09:07:29",NULL
"1495","750","Et dicta illum quasi repellendus totam saepe laudantium. Doloremque hic aut quidem consequuntur magnam modi. Optio esse ut fugiat ab.","completed","2020-06-20 09:07:29",NULL
"1496","751","Rerum laudantium ratione id cum excepturi tempora. Voluptas officia maxime voluptatem impedit. Blanditiis molestias at perferendis aperiam omnis non corporis. Ut et quia et natus vel sit omnis. Qui harum harum ea enim accusantium aperiam dolores.","inprogress","2020-06-20 09:07:29",NULL
"1497","751","Doloribus rerum repellat odio vel. Quidem minima sit est quas libero tenetur eligendi voluptatem. Et quia eum quia.","inprogress","2020-06-20 09:07:29",NULL
"1498","751","Minima soluta ut excepturi eum aliquam quae earum. Quas ipsam officiis enim nobis. Eos laborum nemo quo architecto totam in reiciendis. Voluptatibus ipsa quo voluptas dolores velit mollitia.","inprogress","2020-06-20 09:07:29",NULL
"1499","752","Reiciendis velit soluta et itaque et sit dolore corporis. Fugit mollitia reiciendis commodi in ut id hic soluta. Magnam officiis vitae nulla sequi nemo tempora est.","pending","2020-06-20 09:07:29",NULL
"1500","752","Sit voluptas dolores et esse harum sint dolorem. Dolorum culpa consequatur aut unde ratione dolor voluptatum. Voluptas praesentium quos cupiditate iste aut magnam.","pending","2020-06-20 09:07:29",NULL
"1501","753","Temporibus aut enim mollitia possimus vero nisi illum. Possimus eos voluptatum omnis quaerat voluptas doloremque ratione. Consequatur voluptatem impedit dolorem voluptas.","pending","2020-06-20 09:07:30",NULL
"1502","754","Voluptas sint provident est et vitae et et. Est doloremque eum dolorum suscipit ab. Impedit recusandae quos perspiciatis omnis qui autem voluptatem.","pending","2020-06-20 09:07:30",NULL
"1503","754","Eos ipsum molestiae libero animi pariatur non nesciunt. Ipsum ex porro magnam soluta. Beatae doloribus aut sit voluptatem occaecati.","completed","2020-06-20 09:07:30",NULL
"1504","755","Alias perferendis molestiae eos. Atque voluptas non molestias cupiditate repudiandae facere aut aut. Eos aperiam nihil nesciunt dolore enim ut.","pending","2020-06-20 09:07:30",NULL
"1505","755","Omnis magni maiores ut ipsum sint. Reiciendis sit voluptas aspernatur sed sed necessitatibus. Ipsum est saepe laboriosam nihil. Nostrum sunt fugit recusandae aliquam in fuga assumenda.","completed","2020-06-20 09:07:30",NULL
"1506","756","Doloremque corporis sed hic. Quidem ipsa et consequatur cum explicabo.","pending","2020-06-20 09:07:30",NULL
"1507","757","Eius eligendi modi labore neque. Quia dolorem aliquid perspiciatis necessitatibus. Delectus occaecati cum enim hic.","pending","2020-06-20 09:07:30",NULL
"1508","758","Harum ut ut ipsum aut et. Architecto sed impedit porro consectetur quis. Provident explicabo et sit consequatur. Expedita aut laborum commodi voluptatem.","pending","2020-06-20 09:07:31",NULL
"1509","759","Eveniet dolores velit modi mollitia architecto. Sed numquam ipsam quam id voluptatem aspernatur est sit. Veritatis amet aliquam voluptatem accusantium. Eum ut optio inventore accusamus non explicabo quasi.","pending","2020-06-20 09:07:31",NULL
"1510","759","Error id sit odio. Voluptatibus nihil blanditiis dolor et. Officiis expedita est harum facere quidem.","pending","2020-06-20 09:07:31",NULL
"1511","759","At eum nostrum sint dolor. Voluptate vitae voluptatem suscipit incidunt. Et harum repellat facilis fuga sunt est. Et nisi explicabo et.","inprogress","2020-06-20 09:07:31",NULL
"1512","760","Cum unde eum aut adipisci ab architecto. Qui quia sapiente aliquam accusamus autem quia. Autem laudantium corporis dolore vero saepe. Reprehenderit asperiores laborum qui quo ipsum.","completed","2020-06-20 09:07:31",NULL
"1513","761","Qui tempore voluptatem tenetur hic nam. Nisi magnam est illum praesentium veniam quibusdam. Consequatur facilis laboriosam sunt. Quis quia ipsa odio laboriosam minima earum.","pending","2020-06-20 09:07:31",NULL
"1514","761","Quam doloremque autem est impedit sit consectetur totam. Esse enim libero optio vitae. Nihil dolore cum voluptatem et quo architecto quidem.","completed","2020-06-20 09:07:31",NULL
"1515","761","Reprehenderit iure porro vel sint magni quasi. Est expedita vel reiciendis excepturi. Culpa eum est dolor aspernatur corrupti voluptate.","completed","2020-06-20 09:07:31",NULL
"1516","762","Voluptatem voluptatum commodi aut accusantium sunt deleniti autem. Iure dolor nisi rerum iste iusto ipsam soluta. Quo quas illum qui fuga quisquam vitae. Aut velit quo ut autem est fugit pariatur.","pending","2020-06-20 09:07:32",NULL
"1517","763","Libero doloremque doloremque ea ut deleniti. Voluptatem possimus quis autem accusantium nisi. Adipisci delectus est minima repellendus reprehenderit. Enim et aut sit cum laudantium.","completed","2020-06-20 09:07:32",NULL
"1518","763","Nostrum et corporis quos. Ut dignissimos deleniti ut eum et est. Voluptatibus reiciendis eum et amet distinctio fuga animi. Ea pariatur totam nam qui qui.","pending","2020-06-20 09:07:32",NULL
"1519","764","Dignissimos sint voluptas dolores qui minus nisi eveniet. Dolor ipsam et rem at qui odit veniam. Explicabo sint architecto ipsum dolore eveniet.","inprogress","2020-06-20 09:07:32",NULL
"1520","764","Neque eveniet quia incidunt ea ratione magni officia deleniti. Et est sint aperiam iste optio quaerat exercitationem accusantium. Est eum harum nesciunt perspiciatis enim eligendi exercitationem aut.","pending","2020-06-20 09:07:32",NULL
"1521","764","Nihil temporibus repellendus quo repudiandae et. Placeat non nam illum provident minima. Molestias itaque quia dolorem molestiae velit culpa.","inprogress","2020-06-20 09:07:32",NULL
"1522","765","Quis velit voluptates aut autem porro molestias adipisci. Voluptatibus officia fuga mollitia cum. Ea dicta maxime nostrum. Expedita et omnis omnis a aliquid. Illo animi quod est quis nam voluptatem.","completed","2020-06-20 09:07:33",NULL
"1523","765","Inventore deleniti inventore quis facilis magnam consectetur. Ut corrupti quos vitae eum earum voluptatibus sed. Dolor rem sed ipsa blanditiis cum. Consequatur maxime occaecati quas voluptatem quod nostrum.","completed","2020-06-20 09:07:33",NULL
"1524","766","Magnam rerum recusandae corrupti adipisci qui. Voluptate est pariatur mollitia distinctio aperiam. Saepe veritatis assumenda eos animi.","completed","2020-06-20 09:07:33",NULL
"1525","766","Asperiores incidunt nihil inventore enim. Consequatur adipisci est placeat delectus. Sit quo dignissimos occaecati culpa voluptate dolorem magnam. Architecto quibusdam eligendi occaecati alias debitis.","pending","2020-06-20 09:07:33",NULL
"1526","766","Excepturi perferendis eos nam totam repudiandae occaecati. Quia pariatur nobis non eius et et nesciunt omnis.","pending","2020-06-20 09:07:33",NULL
"1527","767","Et rerum rerum quia repudiandae quo consequatur. Quo ex recusandae sit omnis officia. Aut aut dolores qui voluptates eveniet ducimus et non.","pending","2020-06-20 09:07:33",NULL
"1528","767","Asperiores ratione deleniti est enim eveniet. Sed est fugit et consequatur totam deserunt tenetur atque. Excepturi et fuga incidunt pariatur. Ducimus omnis perspiciatis labore quam vero earum aliquam. Repellendus et velit ullam et reiciendis voluptatem voluptatem.","inprogress","2020-06-20 09:07:33",NULL
"1529","767","At provident eligendi eos ut adipisci velit. Rerum ducimus dolores sunt quo et qui nesciunt. Id incidunt dolorum laboriosam qui sint sit explicabo. Aut saepe provident nulla quam et eos.","inprogress","2020-06-20 09:07:33",NULL
"1530","768","Quia voluptas explicabo delectus quia accusamus et. Debitis excepturi aliquam qui animi laboriosam vero fuga. Sed quae tenetur sunt enim saepe minus. Non aut et qui numquam optio ut in.","pending","2020-06-20 09:07:33",NULL
"1531","768","Temporibus quo dolor reprehenderit nobis fugit aut. Saepe voluptas molestiae non qui eum rerum vero. Suscipit impedit quos minus.","completed","2020-06-20 09:07:33",NULL
"1532","769","Similique soluta qui non illum ut. Non consequatur accusantium quisquam consequatur sed quod qui sint.","inprogress","2020-06-20 09:07:34",NULL
"1533","769","Blanditiis ducimus eum voluptatem quo eum. Voluptate est aut ut possimus temporibus quae. Temporibus et necessitatibus et ea et iure.","inprogress","2020-06-20 09:07:34",NULL
"1534","770","Velit aut sunt excepturi deleniti dolorem illum libero sed. Sint aut molestias autem deserunt et. Consectetur ut eum eveniet nihil omnis nesciunt. Sequi a sunt quisquam provident expedita eius deserunt.","completed","2020-06-20 09:07:34",NULL
"1535","770","Ad qui cum impedit reiciendis. Et id facilis delectus natus. Ea perferendis aut id inventore modi rerum. Sint sed perspiciatis dolorem aut architecto rem hic.","inprogress","2020-06-20 09:07:34",NULL
"1536","771","Esse corporis qui expedita impedit omnis. Voluptates vitae odit qui nisi excepturi. Nulla ut vel accusamus ad ab quia veniam. Veniam quod aspernatur quae.","completed","2020-06-20 09:07:34",NULL
"1537","771","Incidunt est cum omnis tenetur porro vero. Similique rerum aliquid quos praesentium provident nemo officia. Omnis maxime autem perspiciatis tempore ab sit. Eos consectetur omnis perferendis beatae velit et enim.","pending","2020-06-20 09:07:34",NULL
"1538","771","Sit rerum accusantium optio laboriosam veritatis. Delectus ut perferendis maxime aspernatur.","pending","2020-06-20 09:07:34",NULL
"1539","772","Ratione ipsa autem iusto eum animi explicabo. Odit corporis provident impedit assumenda quis inventore.","completed","2020-06-20 09:07:34",NULL
"1540","772","Et necessitatibus voluptatem sed suscipit. Officiis asperiores rerum voluptatum quas. Facere reiciendis modi optio tempore et a nihil. Quas optio dolor eos porro aut.","completed","2020-06-20 09:07:34",NULL
"1541","773","Nihil sapiente vel eos aperiam laudantium. Aut aperiam totam reprehenderit fugiat odio odit. Laborum magni eius recusandae consequuntur voluptatem explicabo dolorem. Maxime quod expedita officia fugit quia voluptas expedita.","completed","2020-06-20 09:07:35",NULL
"1542","774","Earum sed voluptatum mollitia ex et veritatis rerum. Eveniet placeat quos minus esse et rerum. Doloremque porro sint architecto.","completed","2020-06-20 09:07:35",NULL
"1543","774","Officia corrupti rerum culpa iusto. Eos odit vitae assumenda alias reiciendis quis. Adipisci quis reprehenderit perspiciatis et.","inprogress","2020-06-20 09:07:35",NULL
"1544","774","Ratione eum aut eligendi placeat ut voluptates autem. Velit ab eligendi libero alias quae necessitatibus consequatur.","completed","2020-06-20 09:07:35",NULL
"1545","775","Eaque deserunt sunt quia est autem. Adipisci eligendi est quidem odit cum natus. Deleniti quasi consequatur voluptate cupiditate. Soluta nobis earum sed ea commodi.","pending","2020-06-20 09:07:35",NULL
"1546","775","Eaque repellendus quo nisi accusamus commodi perspiciatis. Non repellat a sapiente voluptatem omnis. Et molestiae facilis voluptas explicabo delectus maxime.","pending","2020-06-20 09:07:35",NULL
"1547","776","Eum dolore quaerat porro debitis natus in eos iure. Est officiis saepe nihil a. Et reiciendis magni corporis eius est.","pending","2020-06-20 09:07:35",NULL
"1548","776","Velit qui dolorem repellendus consequuntur beatae quo consectetur iste. Consequatur fuga nobis ipsam delectus et quia. Repellat quam eveniet et et aut deleniti et eius.","inprogress","2020-06-20 09:07:35",NULL
"1549","777","Quaerat omnis eos consectetur non quis ut autem. Qui rerum et et quasi nemo aperiam. Aut ullam quod nisi.","pending","2020-06-20 09:07:35",NULL
"1550","777","Perspiciatis ratione in eum aut. Temporibus quos dolore asperiores sit velit aut inventore. Nam nisi assumenda mollitia error quam animi. Recusandae saepe minus dignissimos quod tenetur.","pending","2020-06-20 09:07:35",NULL
"1551","777","Aut et vitae nihil quos in. Itaque voluptate dolorem quibusdam velit ipsum enim aliquid quaerat. Sunt quos numquam id.","completed","2020-06-20 09:07:35",NULL
"1552","778","Et aut voluptatem officia quia est. Quod iusto enim velit exercitationem consequatur blanditiis. Nihil aperiam nihil qui animi.","completed","2020-06-20 09:07:35",NULL
"1553","778","Et laudantium quidem voluptas aut. Alias suscipit molestiae impedit. Nulla laudantium enim cumque voluptas culpa vitae.","pending","2020-06-20 09:07:35",NULL
"1554","779","Sunt deserunt dolorem quos et mollitia. Ut aut iste enim. Saepe rem recusandae distinctio facere sunt. Quos perspiciatis omnis quod est dolorem.","completed","2020-06-20 09:07:36",NULL
"1555","779","Vero sunt rerum delectus. Odit delectus sint laborum architecto dolorem rem. Officia molestiae sint est. Vel assumenda sequi inventore praesentium sequi minus sed. Itaque omnis cum quibusdam reprehenderit corporis neque.","inprogress","2020-06-20 09:07:36",NULL
"1556","779","Odit nobis libero ea eos et est ut mollitia. Est facilis deserunt beatae provident veritatis sequi illum beatae. Temporibus sequi in nam eum sed molestiae.","inprogress","2020-06-20 09:07:36",NULL
"1557","780","Exercitationem aut ipsa et tenetur repudiandae eum. Ratione ea eligendi eum totam dignissimos vel sunt soluta. Rem officiis unde blanditiis animi dolores labore harum. Vitae culpa est quidem non nihil. Assumenda perspiciatis corporis quibusdam tenetur ut voluptatibus.","completed","2020-06-20 09:07:36",NULL
"1558","780","Omnis molestias ab sit iure vel quo dolor sint. Maiores veritatis eveniet animi ut occaecati. Ullam ab non et. Sed magni inventore qui porro.","pending","2020-06-20 09:07:36",NULL
"1559","780","Quidem dignissimos reprehenderit enim. Id consequatur earum quos autem sit. Dolorum aut cumque vero vitae. Explicabo quia vel omnis illum.","pending","2020-06-20 09:07:36",NULL
"1560","781","Voluptatum voluptatibus suscipit explicabo labore et nam velit. Enim voluptas libero numquam asperiores veniam expedita iure labore. Veniam fugiat occaecati voluptatem quia. Non in magnam unde et nisi quas.","pending","2020-06-20 09:07:36",NULL
"1561","781","Minima distinctio in laboriosam quia aut aut. Quas facere voluptas natus nobis illum cum maiores ratione. Dolorem fuga doloribus perferendis excepturi eius id. Quaerat voluptates eaque sed est ea quas.","completed","2020-06-20 09:07:36",NULL
"1562","782","Magnam et et consequatur reprehenderit earum animi. Laboriosam in fuga corporis vitae amet at autem. Rem pariatur qui quis architecto eligendi.","pending","2020-06-20 09:07:37",NULL
"1563","783","Adipisci et voluptatibus tenetur exercitationem praesentium. Rerum deleniti nam dolore eum. Tenetur reprehenderit voluptates facere ad enim aut porro accusamus.","pending","2020-06-20 09:07:37",NULL
"1564","783","Blanditiis dolorum nihil ullam quis ducimus quis. Autem explicabo occaecati et libero perspiciatis qui numquam. Qui distinctio doloribus ut fugit rerum ipsa. Impedit libero est et animi omnis.","completed","2020-06-20 09:07:37",NULL
"1565","783","Esse aut amet mollitia possimus aut dolorem occaecati. Magni molestiae excepturi qui facilis ut aut eligendi. Velit natus incidunt similique velit. Dignissimos quia et laudantium non eos est eum.","inprogress","2020-06-20 09:07:37",NULL
"1566","784","Enim porro numquam harum quibusdam. Id voluptas amet incidunt deserunt commodi. Porro quibusdam fuga ea et cumque.","pending","2020-06-20 09:07:37",NULL
"1567","784","Provident culpa eius eaque magnam qui quas. Libero distinctio dolor nisi ut ratione. Dolor omnis qui autem et atque enim. Dolorem ut sunt provident laboriosam et reprehenderit.","pending","2020-06-20 09:07:37",NULL
"1568","784","Est aliquam quasi inventore voluptate totam. Incidunt adipisci fugit quae reiciendis. At sed eos aut doloremque impedit et.","pending","2020-06-20 09:07:37",NULL
"1569","785","Excepturi dolores dolor eius voluptatem voluptatum. Dolorem atque illum voluptas itaque cumque molestiae dolor expedita. Autem totam tempore dolore eos vero dolor aut.","pending","2020-06-20 09:07:38",NULL
"1570","786","Laudantium sunt atque repellendus quia. Provident ut ut quisquam tenetur sint maxime maxime vel. Odio et et ducimus esse.","inprogress","2020-06-20 09:07:38",NULL
"1571","786","Culpa eius reprehenderit corrupti est perferendis. Incidunt cum est corporis cum cum sunt qui. Odit est est totam nesciunt sed vitae placeat. Rerum fugit doloribus natus eveniet.","inprogress","2020-06-20 09:07:38",NULL
"1572","787","Ipsa voluptatibus sit fuga enim suscipit. Culpa facere possimus porro velit voluptatem. Voluptatem sint voluptates ipsum accusantium. Consequatur quia eum tenetur qui odit quis.","completed","2020-06-20 09:07:38",NULL
"1573","788","Expedita tenetur quisquam dolorem quia delectus error impedit. Reiciendis expedita est molestias sed exercitationem excepturi illum. Et consequatur quas veniam repellendus eveniet mollitia.","inprogress","2020-06-20 09:07:38",NULL
"1574","788","Qui voluptas fugit molestiae sit nostrum ipsa. Doloribus occaecati distinctio consectetur aliquam eum et. Sint odit distinctio ea et aut asperiores dolorum.","inprogress","2020-06-20 09:07:39",NULL
"1575","789","Quibusdam voluptates numquam corrupti autem eos aperiam. Placeat perspiciatis quia ut dolorem. Incidunt omnis rerum sunt occaecati eos. Esse aut aut eligendi cum necessitatibus. Architecto vel praesentium architecto.","inprogress","2020-06-20 09:07:39",NULL
"1576","789","Autem cumque ea nisi qui. Qui beatae placeat atque necessitatibus fuga. Omnis accusamus qui officia voluptate. Accusantium omnis pariatur dolorem qui animi voluptate beatae.","pending","2020-06-20 09:07:39",NULL
"1577","789","Eligendi ipsam maiores repellat odio dolore. Dolores eaque corrupti voluptas modi quia ex. Molestiae sit tempora natus sunt exercitationem nihil possimus sit.","pending","2020-06-20 09:07:39",NULL
"1578","790","Deleniti a omnis doloribus commodi. Voluptates consequatur a reprehenderit excepturi consequuntur est.","inprogress","2020-06-20 09:07:39",NULL
"1579","790","Eius voluptatem ut dolorem consectetur praesentium. Provident omnis eos et similique voluptas officia et veniam. Reiciendis eum ut commodi harum quis atque.","pending","2020-06-20 09:07:39",NULL
"1580","791","Quia voluptatem sapiente iure enim reprehenderit libero. Tempore tenetur doloremque deleniti corrupti adipisci eum animi. Ratione pariatur repellendus illum voluptas. Id aut aut ea quod.","pending","2020-06-20 09:07:39",NULL
"1581","791","Quia a quos natus laboriosam quo ipsam. Consequuntur alias ullam adipisci voluptatem. Et voluptas id nulla quia facilis sit. Tenetur amet nobis et iure sequi.","completed","2020-06-20 09:07:39",NULL
"1582","791","Eos modi quia possimus nemo. Sed rerum esse sint accusantium consequuntur voluptatem tenetur. Velit culpa et voluptates nostrum. Exercitationem praesentium odio temporibus asperiores et labore.","inprogress","2020-06-20 09:07:39",NULL
