"id","user_id","message","status","createdAt","updatedAt"
"981","484","Cumque culpa molestias eum sit est aperiam aut. Voluptatem nihil earum libero. Quibusdam fuga tempora nihil amet beatae voluptatem. Laudantium nihil beatae exercitationem inventore magni.","inprogress","2020-06-20 09:06:12",NULL
"982","484","Provident dolor autem officiis earum et. Sed sunt et blanditiis quo provident in ullam. Doloremque sequi quidem doloribus facere. Ullam expedita nulla quos quos numquam et esse.","completed","2020-06-20 09:06:12",NULL
"983","485","Aut illum natus consequatur sint fuga qui. Omnis est qui non repellendus delectus. Excepturi ipsa aut aut ut.","inprogress","2020-06-20 09:06:12",NULL
"984","485","Voluptatem quis facere nemo nobis accusamus quia. Ad enim ex et in voluptas perspiciatis molestias velit. Voluptatem quisquam est suscipit numquam.","pending","2020-06-20 09:06:12",NULL
"985","485","Et voluptate ab quis illo amet est sit. Non qui error aspernatur at nostrum. Veniam et ullam vel tenetur non ut corrupti temporibus.","completed","2020-06-20 09:06:12",NULL
"986","486","Placeat et iure deserunt deserunt nihil quod magnam eius. Natus sit dolorem unde maiores molestias dolorem. Molestiae consectetur dolores odit nihil iure voluptatem ut est.","completed","2020-06-20 09:06:12",NULL
"987","486","Magnam dicta ut blanditiis itaque voluptatem. Incidunt ut dolore explicabo ut sed. Corrupti quam qui rerum ad voluptas beatae.","pending","2020-06-20 09:06:12",NULL
"988","486","Facilis maxime distinctio optio architecto earum est. Aut dicta autem perspiciatis a sed voluptatem. Ea aspernatur qui nihil minima iure. Eum totam eum perferendis autem qui recusandae hic sit.","inprogress","2020-06-20 09:06:12",NULL
"989","487","Soluta doloribus maxime itaque voluptas. Omnis iste est provident et.","completed","2020-06-20 09:06:13",NULL
"990","488","Velit dolorem delectus necessitatibus architecto maiores officia. Id dolor omnis temporibus qui. Reiciendis porro consequuntur nulla nisi tenetur aspernatur qui. Minus sed aut ad ullam temporibus.","pending","2020-06-20 09:06:13",NULL
"991","488","Quo recusandae perspiciatis labore non dolorem dolorum rem. Totam atque tempore vel modi.","completed","2020-06-20 09:06:13",NULL
"992","489","Dolor ut asperiores eum et repudiandae. Officiis officiis quae deleniti cum molestias sit. Consequatur sint id deserunt voluptas non. Itaque dolorum corporis cupiditate deserunt.","pending","2020-06-20 09:06:14",NULL
"993","489","Vel illo quisquam quis nam dolores rerum nostrum. Voluptatem voluptatem id ab voluptas. Optio voluptatem et nam. Qui voluptatum ducimus et occaecati in minus.","completed","2020-06-20 09:06:14",NULL
"994","490","Est eum optio sit et. Eos voluptatem ut sequi ea deserunt natus itaque. Voluptates facere molestiae ad non ab velit. A laboriosam eum aut repellat saepe.","completed","2020-06-20 09:06:14",NULL
"995","491","Unde illo accusamus asperiores perspiciatis velit natus et. Cupiditate ea pariatur dignissimos dolores aut temporibus et veniam. Amet aut minus facilis omnis consequatur omnis. Quia laboriosam qui veniam et atque voluptates consequatur.","inprogress","2020-06-20 09:06:14",NULL
"996","491","Ducimus itaque optio expedita debitis et. Est voluptate maxime rerum vero saepe assumenda harum cum.","completed","2020-06-20 09:06:14",NULL
"997","491","Reiciendis sit facilis consequuntur officiis. Consequatur omnis natus sunt quisquam provident veritatis ut. A impedit aperiam non adipisci.","completed","2020-06-20 09:06:14",NULL
"998","492","Est molestias suscipit quis praesentium necessitatibus aut. Ea voluptatibus repellat adipisci totam. Repudiandae dolorum ex consequatur voluptatem voluptatum labore. Soluta et quibusdam amet sint similique fuga.","inprogress","2020-06-20 09:06:14",NULL
"999","492","Eaque nobis voluptatum ipsum quidem. Ut et saepe sit magni cum aliquam. Accusantium et sit et quod qui.","inprogress","2020-06-20 09:06:14",NULL
"1000","492","Perspiciatis distinctio vitae et quisquam aliquam quae dolores. Minus eum possimus ipsam. Et cupiditate ipsa aliquam ab totam nostrum. Alias non minima hic harum expedita quo eos. Harum aliquam optio qui voluptatibus eveniet nihil consequatur.","pending","2020-06-20 09:06:14",NULL
"1001","493","Repellat non rem omnis aspernatur facere. Sit non sint ut quis iusto quis pariatur. Quia blanditiis dolore non omnis voluptates est et eaque. Necessitatibus animi in voluptatem ut et.","completed","2020-06-20 09:06:14",NULL
"1002","494","Qui illum animi placeat harum enim accusamus et amet. Nesciunt ipsam neque consectetur. Minus optio ipsam blanditiis modi numquam rerum voluptas. Adipisci optio quo reprehenderit adipisci earum voluptatum.","completed","2020-06-20 09:06:15",NULL
"1003","494","Iste sit eum provident et optio illo laudantium. Sed sunt quia officiis aperiam voluptas. Placeat iure omnis impedit qui facere aut deserunt. Officiis eius repellendus nulla hic accusantium perspiciatis.","pending","2020-06-20 09:06:15",NULL
"1004","494","Enim adipisci dignissimos ut est architecto. Quos nihil magnam porro omnis.","pending","2020-06-20 09:06:15",NULL
"1005","495","Beatae qui dolorem itaque quis modi eligendi omnis. Neque officia libero aperiam cum.","inprogress","2020-06-20 09:06:15",NULL
"1006","495","Dolorum inventore provident quas impedit qui. Sunt voluptatibus veritatis distinctio eos error. Dolore expedita expedita perferendis accusantium.","inprogress","2020-06-20 09:06:15",NULL
"1007","495","Velit quia ea dolor facilis accusamus nostrum officia. Veritatis tempora magnam molestias neque harum qui nobis. Est aut quisquam animi voluptatem quia. Tempore labore aliquam dolorem.","pending","2020-06-20 09:06:15",NULL
"1008","496","Aut non nihil reiciendis. Et totam consequatur enim qui nihil. Dolorum atque sint dolorem totam.","inprogress","2020-06-20 09:06:15",NULL
"1009","496","Vel autem consequatur ut aliquid reprehenderit minima. Vitae consequatur rerum ut sunt reprehenderit dolor. Debitis architecto error alias est at. Atque et fugiat culpa sequi voluptas possimus.","inprogress","2020-06-20 09:06:15",NULL
"1010","496","Exercitationem aut fugit esse. Sit nam molestiae rem eius. Mollitia porro est sed et.","pending","2020-06-20 09:06:15",NULL
"1011","497","Rerum suscipit id officia quia. Aut aut et cum sint unde labore quos labore. Aspernatur iure illo sunt in.","inprogress","2020-06-20 09:06:16",NULL
"1012","497","Accusamus recusandae vitae sint neque facere repellat quis. Quasi explicabo magnam tenetur dolorum veniam. Expedita maiores aut voluptates dolore officiis. Incidunt soluta sit nisi molestiae blanditiis. Laborum sequi odio debitis incidunt corporis et est quam.","inprogress","2020-06-20 09:06:16",NULL
"1013","497","Adipisci vitae esse quia soluta ea. Distinctio perspiciatis suscipit omnis incidunt sit. Quam aut repellendus natus nihil. Nihil doloremque minima qui fugiat.","pending","2020-06-20 09:06:16",NULL
"1014","498","Et incidunt ex ut minus voluptas autem. Voluptatem voluptatem aut deserunt voluptatum rerum animi. Corrupti animi quia deleniti sed consequatur. Fuga et id corporis.","completed","2020-06-20 09:06:16",NULL
"1015","498","Nostrum quam porro eum iste mollitia fugiat. In deleniti facilis debitis eos. Libero vero ea quisquam et impedit possimus reiciendis velit.","completed","2020-06-20 09:06:16",NULL
"1016","499","Nesciunt sit esse omnis quo illo dolorem aut. Rem esse dolorem omnis fuga. Deleniti et enim accusantium omnis.","completed","2020-06-20 09:06:16",NULL
"1017","499","Explicabo sequi qui dolore totam est possimus. Temporibus autem quo ut commodi. Architecto rerum eaque et sequi aut accusamus excepturi. Vitae totam doloribus assumenda placeat reprehenderit quaerat autem.","completed","2020-06-20 09:06:16",NULL
"1018","499","Aut aut consequatur sed nihil dolorem et facilis. Et consequatur velit et rerum sed ut qui quod. Voluptatem est rerum accusantium architecto laudantium vel. Et qui qui sed ut enim et.","pending","2020-06-20 09:06:16",NULL
"1019","500","Maxime rerum molestiae aut quasi eaque eius sit sed. Quos voluptatibus consectetur placeat voluptas deleniti. Aut rem consequatur maiores beatae laborum officia et. Veritatis ut aliquam adipisci minima voluptas ut. Earum et et enim sit quia.","pending","2020-06-20 09:06:17",NULL
"1020","501","Sit nostrum quae vitae sequi consectetur et esse. Autem ut facilis enim voluptates voluptate. Quae autem enim quas. Architecto et velit molestiae molestiae exercitationem vero quam.","completed","2020-06-20 09:06:17",NULL
"1021","502","Eum fuga et maxime. Deleniti ea ullam dolorem quas.","pending","2020-06-20 09:06:17",NULL
"1022","502","Vitae alias qui ad eum voluptates sapiente non exercitationem. Reprehenderit quibusdam dolorum eveniet dolore sed non eum. Molestiae tenetur voluptatem numquam ut vel.","inprogress","2020-06-20 09:06:17",NULL
"1023","503","Est sed numquam dolorem et. Molestiae qui ea vel sit. Dolore cum occaecati sit rerum eligendi. Officia quam accusantium facere corrupti.","completed","2020-06-20 09:06:17",NULL
"1024","503","Repellat corporis eius sed debitis aperiam unde perferendis. Suscipit voluptas dolor alias odio autem. Libero non quisquam et. Consequuntur fugit error ut.","completed","2020-06-20 09:06:17",NULL
"1025","503","Labore ut neque enim eos. Assumenda doloremque et facilis libero sint rerum. Dolorem consequuntur explicabo ipsa voluptas. Porro quis numquam quas quidem eius quis molestiae.","completed","2020-06-20 09:06:17",NULL
"1026","504","Non assumenda recusandae aut officia aliquid sit voluptatem dicta. Nihil laudantium et rerum est. Aut et ut similique rerum nulla.","completed","2020-06-20 09:06:18",NULL
"1027","504","Non repellat doloremque vero tempore numquam enim. Est occaecati facilis esse ipsum possimus dolorum eum.","pending","2020-06-20 09:06:18",NULL
"1028","504","Commodi qui omnis rem commodi. Impedit enim accusamus nostrum distinctio qui non sunt odit.","pending","2020-06-20 09:06:18",NULL
"1029","505","Nobis impedit animi a adipisci quasi quod aperiam. Voluptas nam dolores tempore et iusto et sed. Dicta inventore nihil sint eveniet ab voluptates sapiente. Et qui labore qui aut quos iure consequatur laborum. Quis aut dolore fugit odit suscipit similique.","completed","2020-06-20 09:06:18",NULL
"1030","505","Omnis reprehenderit quia nemo expedita molestias et. Nostrum unde et est consequuntur aut corporis sit. Illo tenetur ad dolor sit expedita. Officia voluptatem labore iusto minima et.","pending","2020-06-20 09:06:18",NULL
"1031","506","Omnis rem suscipit inventore rem voluptatibus. Inventore non sed ut eaque. Quod ut nihil officiis vitae. Eos aut id nihil accusantium consectetur cupiditate consequatur.","inprogress","2020-06-20 09:06:18",NULL
"1032","507","Ea ea modi perspiciatis provident aut. Sint voluptates mollitia porro quia et eligendi explicabo beatae. Possimus praesentium ea expedita suscipit sit. Eum nulla nam eligendi velit non. Eligendi et molestiae excepturi cumque et in exercitationem.","inprogress","2020-06-20 09:06:18",NULL
"1033","508","Quasi optio quisquam cumque voluptate ratione. Et quaerat qui nihil totam commodi voluptas voluptas. Quam similique voluptate ab totam aliquam. Et id veniam id repellendus.","completed","2020-06-20 09:06:19",NULL
"1034","508","Dolor ut aut quae alias a totam dignissimos. Voluptatem fugit qui autem sit ad amet dolorem. Recusandae ut commodi impedit voluptatem ad aut. Placeat cumque perspiciatis ab vel nulla tempora. Est labore earum et qui.","pending","2020-06-20 09:06:19",NULL
"1035","509","Qui rerum voluptatum quam veritatis minus unde asperiores. Ea recusandae sequi assumenda deleniti voluptatem sapiente animi. Corporis enim fugit voluptatem ipsa fuga.","pending","2020-06-20 09:06:19",NULL
"1036","509","Exercitationem est illo beatae et. Facilis aperiam consectetur totam possimus quod delectus similique. Magnam quo et ab totam odit. Perspiciatis dolores officiis nam voluptas veritatis. Porro qui animi est sit est iusto exercitationem.","pending","2020-06-20 09:06:19",NULL
"1037","509","Et est voluptatum voluptas nostrum iure mollitia quia. Vel enim id quo qui omnis omnis. Voluptatem facilis recusandae quos vitae nemo velit impedit illo. Dicta est nobis earum ex fuga perspiciatis.","inprogress","2020-06-20 09:06:19",NULL
"1038","510","Consectetur eos dolor consequatur. Vero deleniti provident quis ab laborum esse. Dolores laudantium minima alias sunt eos est labore. Voluptas delectus error sint perferendis minus.","completed","2020-06-20 09:06:19",NULL
"1039","510","Provident est ipsam officiis ea. Nesciunt eligendi voluptatum neque accusantium natus voluptatem. Illo dolore minus maiores ab et rem. Amet nihil impedit dolor enim illo sed reiciendis qui.","inprogress","2020-06-20 09:06:19",NULL
"1040","510","Vel autem quasi hic sit. Repudiandae dolorum labore dolorem saepe explicabo accusamus exercitationem aliquam. Aut velit deserunt tenetur commodi sapiente consequatur autem earum. Animi labore nihil aspernatur necessitatibus.","completed","2020-06-20 09:06:19",NULL
"1041","511","Quia iure aliquid facere cumque dolores. Magni neque laborum eligendi molestias. Iste fuga quod iste laudantium. Dicta pariatur atque quam consequatur ex doloremque.","pending","2020-06-20 09:06:20",NULL
"1042","511","Sed deserunt animi omnis ut in exercitationem occaecati. Odit et quasi ut voluptate rerum totam. Necessitatibus minus sint et laudantium maxime.","completed","2020-06-20 09:06:20",NULL
"1043","511","Beatae atque rerum qui modi quos voluptatum neque error. Aut dolores vel officia aut dolores voluptate.","inprogress","2020-06-20 09:06:20",NULL
"1044","512","Officiis beatae voluptatem quibusdam molestiae. Velit et itaque est doloremque officia incidunt. Voluptatibus dignissimos eveniet ab.","pending","2020-06-20 09:06:20",NULL
"1045","513","Sint nesciunt asperiores quia harum. Maiores tenetur voluptatem facilis repellendus. Ex facilis similique autem et in ipsa est. Qui deleniti cumque est itaque placeat pariatur doloremque. Culpa numquam adipisci nostrum consequatur rerum dolorem.","completed","2020-06-20 09:06:20",NULL
"1046","513","Veritatis provident vel ut quod occaecati. Veniam voluptatem et molestiae occaecati animi. In illo et nihil accusantium tempora ipsum. Voluptas qui aut voluptas eos voluptas quis iusto illum. Omnis consequatur sequi similique magnam quia ut assumenda illo.","completed","2020-06-20 09:06:21",NULL
"1047","514","Eum distinctio ut voluptas ipsa iure deserunt. Distinctio voluptatem atque omnis sit iure praesentium in eaque. Minus temporibus magnam officia autem ipsum ad. Aut molestiae praesentium qui praesentium molestiae ut.","inprogress","2020-06-20 09:06:21",NULL
"1048","514","Porro voluptatem molestias voluptatem asperiores qui. Soluta assumenda illum quis. Quis et consequatur minus tenetur.","pending","2020-06-20 09:06:21",NULL
"1049","514","Non nihil iusto magni magnam et soluta possimus. Autem porro quis et occaecati nesciunt quibusdam nisi tempore. Sed similique dicta labore quod tempora qui. Qui quia voluptatem ipsam ducimus qui.","inprogress","2020-06-20 09:06:21",NULL
"1050","515","Atque cum aut provident id et dolor rerum. Quidem eveniet est culpa. Et voluptatum fugiat consequuntur placeat. Distinctio et enim nam sed quo aut vel.","inprogress","2020-06-20 09:06:21",NULL
"1051","515","Id consectetur dolores aut quibusdam ea perspiciatis. Quisquam et accusamus impedit fuga. Voluptatum rerum sint error itaque.","inprogress","2020-06-20 09:06:21",NULL
"1052","515","Distinctio laboriosam dicta eligendi et adipisci tenetur. Enim quia odio unde enim. Optio et nisi nam quidem amet aspernatur.","inprogress","2020-06-20 09:06:21",NULL
"1053","516","Dolor in voluptatem repellat. Ipsa quae praesentium aut blanditiis occaecati qui. Impedit esse laborum delectus iusto ad officia aut. Qui maiores fugit eaque omnis et quae qui.","inprogress","2020-06-20 09:06:21",NULL
"1054","517","Accusantium iusto autem rem aspernatur iure. Numquam tempore non velit qui at dolor maxime. Voluptatem cum enim sit sed.","pending","2020-06-20 09:06:22",NULL
"1055","517","Explicabo ea qui est consequatur labore fuga nesciunt. Voluptas ut enim id nesciunt rem. Provident consequatur impedit quo culpa velit officia molestiae doloremque.","completed","2020-06-20 09:06:22",NULL
"1056","517","Deleniti eum atque quibusdam mollitia sunt ratione. Natus at aut laboriosam. Et molestias dolor sit id enim. Unde occaecati expedita totam quo unde id.","pending","2020-06-20 09:06:22",NULL
"1057","518","Est natus aperiam consectetur et et nihil eum nihil. Cum magni rem voluptatum rerum tempore sit ducimus. Dignissimos asperiores repudiandae ut.","inprogress","2020-06-20 09:06:22",NULL
"1058","518","Consequatur deleniti quaerat debitis libero id. Nulla rerum autem animi qui cumque numquam omnis officiis.","inprogress","2020-06-20 09:06:22",NULL
"1059","518","Dolor facere temporibus laborum. Praesentium cum nulla atque perferendis. Rerum quasi non maxime quis sit beatae voluptatibus.","inprogress","2020-06-20 09:06:22",NULL
"1060","519","Incidunt iste pariatur placeat dolor at. Eum incidunt fuga amet veniam id. Eum quasi sunt sint aut veniam ut sapiente dolores.","pending","2020-06-20 09:06:22",NULL
"1061","519","Ea minima et corrupti. Quis quia recusandae vero facere et ad quos ut. Quas voluptas dolorem eum velit. Non assumenda veniam non magni reprehenderit hic ex.","inprogress","2020-06-20 09:06:22",NULL
"1062","520","Quisquam rerum culpa aliquid dolor aspernatur. Excepturi ullam sunt similique. Ex cupiditate quis consequatur est. Consectetur dolores assumenda ea voluptas earum.","completed","2020-06-20 09:06:22",NULL
"1063","520","Occaecati in iusto quia at. Ab possimus nisi rem. Dolor magni explicabo occaecati adipisci provident culpa. Exercitationem excepturi qui rem ea consequatur animi.","pending","2020-06-20 09:06:22",NULL
"1064","521","Eaque odio provident et corrupti. Sed accusantium ipsum animi unde. Eveniet labore suscipit enim placeat rerum. Ducimus illum vel ipsum.","pending","2020-06-20 09:06:23",NULL
"1065","522","Odit nihil maiores autem modi fugiat quibusdam. Quibusdam praesentium dolores quo natus cumque et cupiditate. Impedit dolorem sit est deleniti at quae animi. Sapiente rerum aut quia facere unde. Vel ducimus illum repellendus.","inprogress","2020-06-20 09:06:23",NULL
"1066","523","Aut est qui quis modi ut qui quos. Minima error similique quia. Ducimus tempora dolores porro. Architecto vel voluptatum fugiat et atque. Expedita harum enim id adipisci aut iure consequuntur.","completed","2020-06-20 09:06:23",NULL
"1067","523","Nihil dolorem nemo id tempora. Nesciunt vel eos quas magni esse. Accusamus facere consequuntur ea recusandae et. Blanditiis inventore qui et corrupti. Possimus molestias quam et est placeat.","pending","2020-06-20 09:06:23",NULL
"1068","523","Dolorem et aperiam tempora accusantium labore. Eaque officiis quia ea qui dolore. Qui quaerat et velit omnis nihil perspiciatis nesciunt amet.","inprogress","2020-06-20 09:06:23",NULL
"1069","524","Minus totam temporibus quae odit vel eum. Voluptates debitis fugit et similique.","pending","2020-06-20 09:06:24",NULL
"1070","524","Omnis voluptatem eos et non adipisci iste molestiae. Et voluptas exercitationem expedita voluptates sed libero vel labore. Voluptas incidunt expedita aspernatur facere quis alias nemo.","inprogress","2020-06-20 09:06:24",NULL
"1071","525","Reiciendis perferendis sed mollitia quaerat. Facere sapiente veritatis quasi placeat quisquam labore est. Voluptate omnis harum repellat quae.","completed","2020-06-20 09:06:24",NULL
"1072","526","Sequi incidunt corporis eaque. Vel dicta eius aspernatur maiores rerum. Illum ipsum aut id consequatur omnis reiciendis cumque ipsa.","pending","2020-06-20 09:06:24",NULL
"1073","527","Ab qui nemo quo facere occaecati minima laboriosam. Itaque dolorem adipisci magnam. Molestiae qui temporibus ad iste. Velit sit reprehenderit est sit.","pending","2020-06-20 09:06:24",NULL
"1074","528","Laboriosam numquam ad neque consectetur. Facere aspernatur excepturi ipsa. Impedit consequuntur assumenda et dolor quae quisquam qui. Facilis sequi et incidunt ut quos nostrum.","inprogress","2020-06-20 09:06:24",NULL
"1075","529","Ea aut quidem molestiae qui perspiciatis quo distinctio. Assumenda libero deleniti facere repellendus sint rem. Et est inventore reiciendis temporibus. Doloremque placeat repellendus odit repudiandae sed sunt iste.","pending","2020-06-20 09:06:25",NULL
"1076","530","Iure soluta laborum quisquam cum. Exercitationem quis necessitatibus perferendis id asperiores deserunt. Et qui quia nostrum et. Possimus vero aperiam corporis fuga ducimus assumenda quis.","completed","2020-06-20 09:06:25",NULL
"1077","531","Dolor vel facere ad deserunt. Quia labore quam accusantium vel. Et dolorum quo illo.","completed","2020-06-20 09:06:25",NULL
"1078","532","Libero quisquam enim occaecati sit accusamus illum at. Dolorem enim laborum ipsam in possimus quibusdam officia. Repudiandae voluptatem id nesciunt esse.","inprogress","2020-06-20 09:06:25",NULL
"1079","532","Quia inventore eos iste. Aut et voluptate ullam ut sapiente occaecati non. A mollitia non quia repudiandae cumque tempora.","pending","2020-06-20 09:06:25",NULL
"1080","533","Porro ullam eveniet et. Qui enim veritatis reprehenderit et natus dolore. Vel aut consectetur deleniti sapiente aut et.","completed","2020-06-20 09:06:26",NULL
"1081","533","Est molestiae eius omnis labore. Vitae necessitatibus dicta consectetur. Est quod officiis maiores accusamus hic.","pending","2020-06-20 09:06:26",NULL
"1082","534","Totam explicabo possimus voluptatem non quis hic excepturi. Dicta dolorum ex esse sed ullam autem. Quos temporibus harum cupiditate asperiores. Qui doloribus aut reiciendis id autem reprehenderit quos.","inprogress","2020-06-20 09:06:26",NULL
"1083","534","Delectus quae velit eum vel qui placeat. Expedita quis quisquam iste excepturi corporis fugit sit cupiditate. Doloribus qui eaque nihil tenetur odio eos eum. Nobis perferendis sit praesentium consectetur nemo porro.","completed","2020-06-20 09:06:26",NULL
"1084","534","Aut consequuntur sunt commodi et. Labore consequatur laboriosam illo. Ut quasi qui sit quaerat accusamus eveniet.","inprogress","2020-06-20 09:06:26",NULL
"1085","535","Molestias non dolor rerum doloremque et architecto nostrum. Fugiat possimus fugiat nihil.","pending","2020-06-20 09:06:26",NULL
"1086","535","Quod dolorum harum sint. Cumque et corporis est est. Et vel autem architecto quia sed ut id id. Nihil voluptas qui aliquam ut.","completed","2020-06-20 09:06:26",NULL
"1087","536","Et corrupti eos dolorem. Possimus ratione officiis cumque amet debitis. Ipsum est asperiores eius vero culpa ratione blanditiis occaecati. Nesciunt natus fugit et rerum dolor.","inprogress","2020-06-20 09:06:27",NULL
"1088","537","Reprehenderit aut pariatur nemo ut amet eaque exercitationem. Aperiam rerum quo officia aperiam et quae. Fuga voluptates quo eum odit quasi quam sit.","completed","2020-06-20 09:06:27",NULL
"1089","538","Recusandae odit et aut aut dicta accusamus quisquam. Molestias omnis asperiores laborum rem. Sint sit rem velit quia delectus. Molestiae eius illum tenetur molestiae et qui voluptatem.","inprogress","2020-06-20 09:06:27",NULL
"1090","538","Inventore itaque quaerat id velit omnis dolore. Hic laudantium quae quos aperiam laborum distinctio reiciendis. Aut in incidunt omnis aperiam culpa est labore laboriosam.","pending","2020-06-20 09:06:27",NULL
"1091","539","Commodi qui architecto magnam illum. Voluptas unde aut quis delectus. Et quisquam et reiciendis aut dignissimos vitae qui. Qui sint optio reiciendis deleniti eligendi omnis. Quo eos eaque dolorum quia architecto soluta.","inprogress","2020-06-20 09:06:28",NULL
"1092","539","Sequi suscipit exercitationem sunt et modi rem tempore. Ut aut magnam natus in cumque ipsum nobis. Minus soluta ea harum aut. Commodi optio possimus dolores sapiente.","inprogress","2020-06-20 09:06:28",NULL
"1093","539","Minima veritatis error et fugit voluptatem aut deserunt nemo. Est ut illo dolorum architecto. Ipsa aperiam saepe modi magni corporis in quaerat.","pending","2020-06-20 09:06:28",NULL
"1094","540","Fugit alias laboriosam explicabo architecto distinctio omnis molestiae voluptatem. Ducimus alias architecto illum ipsa labore at. Dolorem non modi voluptates provident. Ut explicabo voluptatum et molestias perspiciatis.","pending","2020-06-20 09:06:28",NULL
"1095","540","Perspiciatis nihil qui culpa provident aut vel facere. Ut id facere quas magnam quam autem porro. Non ut nesciunt labore ipsa.","completed","2020-06-20 09:06:28",NULL
"1096","540","Quo repudiandae eaque et exercitationem est aut eligendi. Aperiam ut molestiae occaecati harum fuga eos est. Ea omnis voluptas quod est et in. Aut necessitatibus illo explicabo.","pending","2020-06-20 09:06:28",NULL
"1097","541","Ea illum delectus quidem quisquam officiis. Cupiditate quisquam hic architecto in rerum. Molestiae possimus cupiditate quia.","pending","2020-06-20 09:06:28",NULL
"1098","542","Tempore veritatis dolorem tempora consequuntur voluptatem temporibus. Suscipit dolorem maxime eaque deserunt qui. Est quas eveniet facere sit. Optio omnis quam magnam deserunt quas distinctio et et.","completed","2020-06-20 09:06:29",NULL
"1099","542","Eum veritatis consectetur voluptatem et autem repudiandae dicta nam. Sed aliquid non ipsa temporibus quidem possimus. Quod dolor quo quidem sit excepturi.","pending","2020-06-20 09:06:29",NULL
"1100","542","Aut cum sequi velit vel unde. At facilis reiciendis ut dolor provident. Voluptatem numquam adipisci in consequatur optio ipsam perferendis qui. Eum ut distinctio numquam quia et.","completed","2020-06-20 09:06:29",NULL
